"Caporali, Marco ","A Cetta, Elio e Lia Rosa con amicizia Marco 13/2/04",5059,RML0138069 ,RISERVATI.POESIA.CAPORALI.2003(A),"*Casa Bagger / Marco Caporali ; con quattro incisioni di Svend Bagger. - Roma : Il Labirinto, 2003",42.4088° N,12.6872° E,Cottanello,,,13 febbraio 2004,https://drive.google.com/file/d/1gjHYS4epfIXE5iDPzRes7GHwjTFESCv8/view?usp=sharing,
"Caporali, Marco ","Cottanello 18/11/07 A Elio, Cetta e Lia Rosa con l'amicizia di Marco e con questo mi hai fatto scrivere la poesia di pag.....   66",5067,UBO3384948 ,RISERVATI.POESIA.CAPORALI.2007(A),"*Alla fine del solco / Marco Caporali. - Roma : EmpirÌa, ©2007",42.4088° N,12.6872° E,Cottanello,,Cottanello,18 novembre 2007,https://drive.google.com/file/d/1Km5LlPvhl2VwQakABA6qcPEd1J7eKn5N/view?usp=sharing,
"Capriolo, Paola",A Elio Pagliarani cordialmente Paola Capriolo,3718,RAV0313231,RISERVATI NARRATIVA.CAPRIOLO 1998(A) ,"*Barbara / Paola Capriolo. - \Milano! : Bompiani, 1998. - 133 p. ; 23 cm",45.4408° N,9.1900° E,Milano,,,,https://drive.google.com/file/d/1HP9NqYN27XhTna0U0Z5sOktI5OsZS4hk/view?usp=sharing,
"Capriolo, Paola",A Elio Pagliarani cordialmente Paola Capriolo,5058,TO00444693,RISERVATI SAGGISTICA.CAPRIOLO 1996(A) ,"L'*assoluto artificiale : nichilismo e mondo dell'espressione nell'opera saggistica di Gottfried Benn / Paola Capriolo. - Milano : Bompiani, [1996]. - 108 p. ; 22 cm",45.4408° N,9.1900° E,Milano,,,,https://drive.google.com/file/d/1gpzoJElSKx6OKG_TBsObNfM-1j-Dr61N/view?usp=sharing,
Caproni Giorgio,"A Elio Pagliarani, alla sua poesia Giorgio Caproni",4661,RAV0017729,RISERVATI POESIA.CAPRONI 1982(A) ,"Il *franco cacciatore / Giorgio Caproni. - Milano : Garzanti, 1982. - 147 p. ; 22 cm",41.9028° N,12.4964° E,Roma,,,,https://drive.google.com/file/d/1tJI-cJGhPfBUfWvpXA2KjtQ6yW8dbWoz/view?usp=sharing,
"Caproni, Giorgio","A Elio Pagliarani, un suo affezionato lettore",777,CFI0030838,RISERVATI POESIA.CAPRONI 1986(A) ,"Il *conte di Kevenhüller / Giorgio Caproni. - Milano : Garzanti, 1986. - 182 p. ; 21 cm",41.9028° N,12.4964° E,Roma,,,,,
"Caproni, Giorgio"," A Elio Pagliarani, alla sua poesia Giorgio Caproni",785,CFI0007144,RISERVATI POESIA.CAPRONI 1983(A) ,"*Tutte le poesie / Giorgio Caproni. - Milano : Garzanti, 1983. - 632 p. ; 21 cm",41.9028° N,12.4964° E,Roma,,,,https://drive.google.com/file/d/1geaV5NAz7EXBxRpco4S9rMPCxSutDhTH/view?usp=sharing,
"Caproni, Mauro --- Caproni, Silvana",Per Cetta ed Elio Pagliarani da Silvana e Mauro 14-6-91,2362,CFI0185597,RISERVATI POESIA.CAPRONI 1991(A) ,"*Res amissa / Giorgio Caproni ; a cura di Giorgio Agamben. - Milano : Garzanti, 1991. - 228 p. ; 22 cm",41.9028° N,12.4964° E,Roma,"Dedica dei figli di Giorgio Caproni, Silvana e Mauro, a Cetta e Elio Pagliarani",,14 giugno 1991,https://drive.google.com/file/d/1WNRgL8ZRiiv4_EiXIOkuWfyZxwqItwK3/view?usp=sharing,
"Castaldi, Marosia",A Elio Pagliarani con stima (gennaio 1986),3421,URB0453560,RISERVATI NARRATIVA.CASTALDI 1986(A) ,"*Abbastanza prossimo / Marosia Castaldi ; nota critica di Mario Spinella. - Torino : Tam Tam, 1986. - 85 p. ; 22 cm",45.4408° N,9.1900° E,Milano,,,gennaio 1986,https://drive.google.com/file/d/1tCEqlzOW5nF3wyvdGrM3UKt9ugTD27zk/view?usp=sharing,
"Catucci, Leonardo",Per Elio Pagliarani maestro d'arte e simpatia ripensando al 6 ottobre Leonardo Catucci,3713,LIG0023259,RISERVATI POESIA.CATUCCI 2000(A) ,"*Arrampicarmi ancora / Leonardo Catucci. - Roma : Oppure, 2000. - 73 p. ; 18 cm",41.9028° N,12.4964° E,Roma,,,6 ottobre,https://drive.google.com/file/d/1l1PznVhL-PSMxsiAh1mqFQ5YYvkAbRR6/view?usp=sharing,
"Celli, Giorgio",A Elio Pagliarani con immutata simpatia Giorgio Celli,4662,UBO2157283,RISERVATI POESIA.CELLI 1969(A) ,"*Morte di un biologo / Giorgio Celli. - Bologna : Centro Duchamp, 1969. - [23] carte ; 25 cm ((Il verso delle carte è bianco.",44.4949° N,11.3426° E,Bologna,,,,https://drive.google.com/file/d/1tJI-cJGhPfBUfWvpXA2KjtQ6yW8dbWoz/view?usp=sharing,
"Cepollaro, Biagio",A Elio al mio Maestro più caro Biagio,5262,NAP0090118,RISERVATI POESIA.CEPOLLARO 1993(A) ,"*Scribeide : 1985-1989 / Biagio Cepollaro ; introduzione di Romano Luperini. - Lecce : P. Manni, 1993. - 130 p. ; 22 cm",45.4408° N,9.1900° E,Milano,,,,https://drive.google.com/file/d/1JzYmDhAxPu-lH-wgz8TWeJWA5gazW26h/view?usp=sharing,
"Cerniglia, Rossella","A Elio Pagliarani con profonda stima Rossella Cerniglia Palermo, 28 novembre 2003",4956,MIL0630462,RISERVATI POESIA.CERNIGLIA 2003(A) ,"*Mentre cadeva il giorno / Rossella Cerniglia. - Lecce : Manni, [2003]. - 52 p. ; 20 cm",38.1157° N,13.3615° E,Palermo,,Palermo,28 novembre 2003,https://drive.google.com/file/d/1jG07KheVKxeY3-A20eA2IKiAbzUrQq3A/view?usp=sharing,
"Cesarano, Giorgio",Per Elio Pagliarani con viva simpatia Giorgio Cesarano,3947,SBL0143928,RISERVATI POESIA.CESARANO 1963(A) ,"La *pura verità / Giorgio Cesarano. - Milano : A. Mondadori, 1963. - 103 p. ; 18 cm",45.4408° N,9.1900° E,Milano,,,,https://drive.google.com/file/d/1B6xRT0KRYU1qJDlO2QffuU48LhYMns0w/view?usp=sharing,
"Cheney-Coker, Syl","To Elio Pagliarani best weks other Toronto Oct, 90",5811,TO00669851  ,RISERVATI.POESIA.CHENEY-COKER.1990(A),"  The *blood in the deserts eyes : poems / Syl Cheney-Coker. - Oxford : Heinemann, 1990. - 85 p. ; 20 cm",43.6532° N,79.3832° W,Toronto,,Toronto,ottobre 1990,https://drive.google.com/file/d/1nDwZvc42ERRTCuw173qMcjCgN12kpcvu/view?usp=sharing,
"Chilanti, Felice","A Elio Pagliarani come ho detto dedicandogli ""Parla Zarathustra"" e ""Il colpevole"" il tuo Felice Chilanti Roma giugno 69",3944,SBL0103114,RISERVATI NARRATIVA.CHILANTI 1969(A) ,"*Ex / Felice Chilanti ; con uno scritto di Antonio Pizzuto. - Milano : All'insegna del pesce d'oro, 1969. - 158 p. ; 17 cm ((Ed. di 2000 esempl. num.",41.9028° N,12.4964° E,Roma,,Roma,giugno 1969,https://drive.google.com/file/d/1x0SHpX_5PIK3HKt2a4ycSQHJymmeig4Z/view?usp=sharing,
"Ciampi, Piero","1994 A Elio Pagliarani (ricordando una lunga ed affettuosa lettera, 1968!) Piero",5439,IEI0688208,RISERVATI POSIA.CIAMPI 1973(A) ,"*Piero Ciampi 53 poesie. - Roma : RCA, 1973. - [54] p. ; 30 cm",41.9028° N,12.4964° E,Roma,,,1994,https://drive.google.com/file/d/1YE-MfhqMtPYR_EtzKU_kt5duwlsDQHzf/view?usp=sharing,
"Colucci, Carlo Felice",Ad Elio Pagliarani con molta considerazione e simpatia Carlo Felice Colucci  Napoli maggio1979,3652,CFI0468565,RISERVATI NARRATIVA.COLUCCI 1979 (A) ,"I *figli dell'arca / Carlo Felice Colucci. - Roma : Cooperativa scrittori, 1979. - 230 p. ; 20 cm",40.8518° N,14.2681° E,Napoli,,Napoli,maggio 1979,https://drive.google.com/file/d/1RGM6f3S2NYOLocBw7d9ycxU4W92zqt2w/view?usp=sharing,
"Colusso, Tiziana",Ottobre 2004 A Elio Pagliarani con la stima che si deve a un maestro sia pure irriverente T. Colusso,5114,RMB0488494,RISERVATI POESIA.COLUSSO 2004(A) ,"*Italiano per straniati / Tiziana Colusso ; con un saggio di Gaetano delli Santi. - Milano : Fabio D'Ambrosio Ed., [2004]. - 75 p. ; 21 cm",48.8566° N,2.3522° E,Paris,,,ottobre 2004,https://drive.google.com/file/d/1Yubvpj5pIDBFxuLpCEORnpN7d8-Qt840/view?usp=sharing,
"Compagnone, Luigi",A Elio Pagliarani il suo Luigi Compagnone,3697,SBL0599393,RISERVATI.NARRATIVA.COMPAGNONE.1974(A),"*Ballata e morte di un capitano del popolo : Romanzo / Luigi Compagnone. - Milano : Rusconi, 1974. - 212 p. ; 22 cm",40.8518° N,14.2681° E,Napoli,,,,https://drive.google.com/file/d/168g8rAC2c9Bk7NkUVW1JyMdjaAeN3BD6/view?usp=sharing,
"Conti, Laura","Grazie, caro Elio: non dimentico il tuo incoraggiamento Laura",4946,SBL0455411,RISERVATI NARRATIVA.CONTI 1965(A) ,"La *condizione sperimentale / Laura Conti. - Milano : A. Mondadori, 1965. - 238 p. ; 19 cm",45.4408° N,9.1900° E,Milano,,,,https://drive.google.com/file/d/1-hDaKyUkjOF5bsWXedIrvmGyMjxXNMSp/view?usp=sharing,
"Copioli, Rosita","A Cetta, Elio e Lia Rosa Pagliarani",2593,RAV1684209,RISERVATI POESIA.COPIOLI 2008(A) ,"Il *postino fedele / Rosita Copioli. - Milano : Mondadori, 2008. - 172 p. ; 18 cm",44.0678° N,12.5695° E,Rimini,,,,https://drive.google.com/file/d/1R-7NCUXVhJ6vB3igbIEAWw7fLSWoix2V/view?usp=sharing,
"Copioli, Rosita","A Elio, Cetta e Lia Rosa il ricordo di Rosita gennaio 1993",4784,RAV0210913  ,RISERVATI.NARRATIVA.COPIOLI.1993(A),"Il *fuoco dell'Eden / Rosita Copioli ; con VIII tavole di Domenico Bianchi. - Siracusa : Tema celeste, 1992. - 151 p. : ill. ; 18 cm",44.0678° N,12.5695° E,Rimini,,,gennaio 1993,,
"Cordelli, Franco",A Elio con affetto Franco,3669,TO00764486,RISERVATI NARRATIVA.CORDELLI 1999(A) ,"Un *inchino a terra / Franco Cordelli. - Torino : Einaudi, \1999!. - 232 p. ; 23 cmP",45.4408° N,9.1900° E,Milano,,,,https://drive.google.com/file/d/1AYUSBHk-JAR5Kys63zW_vNmWWO-o2wh4/view?usp=sharing,
"Cordelli, Franco",A Elio con affetto Franco,3673,CFI0182446,RISERVATI NARRATIVA.CORDELLI 1990(A) ,"L'*Italia di mattina / Franco Cordelli. - Milano : Leonardo, 1990. - 109 p. ; 23 cm",45.4408° N,9.1900° E,Milano,,,,https://drive.google.com/file/d/1a3UtNBPSc7l8l6l0EzsyHpvuk-1vniXI/view?usp=sharing,
"Cordelli, Franco","Ad Elio con affetto, Franco 7.6.78",3711,RAV0087042,RISERVATI TEATRO.CORDELLI 1978(A) ,"Il *poeta postumo : manie, pettegolezzi, rancori / Franco Cordelli ; foto di Agnese De Donato, Giorgio Piredda. - Cosenza : Lerici, c1978. - 108 p., [44] c. di tav. : fotogr. ; 22 cm",45.4408° N,9.1900° E,Milano,,,7 giugno 1978,,
"Cordelli, Franco",A Elio con l'amicizia del suo Franco Milano 27.1.84,4947,RAV0061557,RISERVATI NARRATIVA.CORDELLI 1983(A) ,"*Proprietà perduta / Franco Cordelli. - Milano : Guanda, 1983. - 242 p. ; 20 cm",45.4642° N,9.1900° E,Milano,,Milano,27 gennaio 1984,,
"Costa, Corrado","Godi, ragazzo dal fiero cipiglio l'avanguardia ha fatto un altro figlio .... a Elio Pagliarani [segue disegno a penna]",501,SBL0274951,RISERVATI POESIA.COSTA 1964(A) ,"*Pseudobaudelaire / Corrado Costa. - Milano : All'insegna del pesce d'oro, 1964. - 51 p. ; 16 cm ((Ed. di 500 esempl. num.",44.4949° N,11.3426° E,Bologna,,,,https://drive.google.com/file/d/10_Wf1-chXgdGQeuT96-ghZXzOaVc4SnN/view?usp=sharing,
"Costantini, Vilma",A Elio Pagliarani con grande stima e ammirazione il frutto di questo mio modesto lavoro sulla poesia cinese Vilma Costantini,805,BRI0002069,RISERVATI ANTOLOGIE.COSTANTINI 1985(A) ,"*Coppe di giada / Li Po, Tu Fu, Po Chu-i ; a cura di  di Vilma Costantini. - Torino : UTET, 1985. - XIX, 274 p. ; 18 cm ((Antologia.",41.9028° N,12.4964° E,Roma,,,,https://drive.google.com/file/d/1Do9IHfvfTuVVaR5UH20dgippnaNH-DDo/view?usp=sharing,
"Coviello, Michelangelo","Al mio Poeta preferito, al mio amico sposato con la ragazza dal sorriso meraviglioso",5644,IEI0691594,RISERVATI.POESIA.COVIELLO.2010(A),"*Michelangelo Coviello. - [S.l.] : Officina di Poesia, 2010. - [20] p. : ill. ; 15 cm ((Tit. della cop. - Stampato nel mese di maggio 2010 in occasione della mostra di Wolmer Cantoni",45.4408° N,9.1900° E,Milano,,,,https://drive.google.com/file/d/1YXjiUUZuqJmjCNxPrjf7ZXQx46brJL5P/view?usp=sharing,
"Cristofaro, Antonella",A Cetta  Petrollo e a Elio Pagliarani amici di un grande critico in carne! Con grande affetto Antonella Cristofaro,5509,LZ10231148,RISERVATI NARRATIVA.CRISTOFARO 2007(A) ,"*All'altezza delle labbra / Antonella Cristofaro. - Roma : Avagliano, [2007]. - 124 p. ; 20 cm",41.9028° N,12.4964° E,Roma,,,,https://drive.google.com/file/d/1UGy-V7e3WlX64Ul9RVljCNW36A-tOpod/view?usp=sharing,
"Crovi, Raffaele",A Elio Raffaele 9.12.1959,823,SBL0500083,RISERVATI POESIA.CROVI 1959(A) ,"L'*inverno / Raffaele Crovi ; con una nota di Giansiro Ferrata. - Caltanissetta [etc.] : S. Sciascia, [1959]. - 56 p. ; 17 cm",45.4408° N,9.1900° E,Milano,,,9 dicembre 1959,https://drive.google.com/file/d/1bw30i8IJMGq0TuORXHPasBp7e2VrCJd5/view?usp=sharing,
"Crovi, Raffaele","A Elio, con forte amicizia, Raffaele18.4.84",4707,CFI0055167,RISERVATI NARRATIVA CROVI 1984(A) ,"*Ladro di ferragosto / Raffaele Crovi. - Milano : Frassinelli, 1984. - 96 p. ; 21 cm",45.4408° N,9.1900° E,Milano,,,18 aprile 1984,,
"Crovi, Raffaele",A Elio un evviva affettuoso da Raffaele,4783,RAV0285368,RISERVATI NARRATIVA.CROVI 1996(A) ,"L'*indagine di via Rapallo : Romanzo / Raffaele Crovi ; disegni originali di Max Casalini. - Casale Monferrato : Piemme, 1996. - 295 p. : ill. ; 22 cm",45.4408° N,9.1900° E,Milano,,,,https://drive.google.com/file/d/1hAuVMmE00ZDa1TzGwxW7-1biVudPj12X/view?usp=sharing,
"Cucchi, Maurizio",A Elio Pagliarani amichevolmente Maurizio Cucchi,4778,SBL0335516,RISERVATI POESIA.CUCCHI 1980(A) ,"Le *meraviglie dell'acqua / Maurizio Cucchi. - Milano : A. Mondadori, 1980. - 91 p. ; 20 cm",45.4408° N,9.1900° E,Milano,,,,https://drive.google.com/file/d/1inKmgOGUTNDiLwg2aHkvrPKyYolyhWOI/view?usp=sharing,
"Cucchi, Maurizio","A Elio Pagliarani molto cordialmente, Maurizio Cucchi",4785,SBL0578409,RISERVATI POESIA.CUCCHI 1976(A) ,"Il *disperso / Maurizio Cucchi. - [Milano] : A. Mondadori, 1976. - 89 p. ; 20 cm",45.4408° N,9.1900° E,Milano,,,,https://drive.google.com/file/d/1OM9ag9mfttVJXkXf5o5mTaMhQ1vFi1Io/view?usp=sharing,
"Cucchi, Maurizio",A Elio Pagliarani con l'amicizia di Maurizio febb. 90,5191,CFI0172903,RISERVATI POESIA.CUCCHI 1990(A) ,"La *luce del distacco : versi per il teatro / Maurizio Cucchi. - Milano : Crocetti, stampa 1990. - 29 p. ; 20 cm",45.4408° N,9.1900° E,Milano,,,febbraio 1990,https://drive.google.com/file/d/1us1VcQ_ebYawxZEqzFxEDGhvVDeSSLJ0/view?usp=sharing,
"Damiani, Claudio","A Elio e Cetta, questa casa: [segue disegno di una casa] Claudio",3701,BVE0070048,RISERVATI POESIA.DAMIANI 1994(A) ,"La *mia casa / Claudio Damiani. - Forte dei Marmi : Galleria Pegaso, stampa 1994. - 60 p. ; 18 cm",41.9028° N,12.4964° E,Roma,,,,https://drive.google.com/file/d/11y3S03JSRmnoLKBn87tE2Dr12GBO7vH8/view?usp=sharing,
"Damiani, Claudio ","A Elio e Cetta questo piccolo libretto, portato insieme al libro di Beppe, Claudio 7 gennaio 88",5269,RMR0019114 ,RISERVATI.POESIE.DAMIANI.1987(A),"*Fraturno / Claudio Damiani ; con due disegni di Beate von Essen. - Roma : Il Melograno-Edizioni Abete, 1987",41.9028° N,12.4964° E,Roma,,,7 gennaio 1988,https://drive.google.com/file/d/1l8Edum4gxof6ZxyHt05CTuUPxryIuuIq/view?usp=sharing,
"De Thomasis, Roberta","Al poeta amico, musico Elio Pagliarani l'amico Maestro della poesia, nel cuore attesa compiuta 63 - 97 - 2001 e poi ... ancora ritmo poesia Speranza, Guido, stasera anche Piera. Roberta Biblioteca Pigneto Roma, 18 dicembre '97",5440,IEI0688211,RISERVATI POESIA.DETHOMASIS 1997(A) ,"*Conchiglie / Roberta De Thomasis. - Pescara : Samizdat, 1997. - 81 p. . ill. ; 20 cm",41.9028° N,12.4964° E,Roma,,Roma,18 dicembre 1997,https://drive.google.com/file/d/1aV8ACMzsbfxZCjpEr_cEC-7tkQPHhVFu/view?usp=sharing,
"De Vita, Ugo",Cetta ed Elio con senso di amicizia Ugo  Roma 30 gennaio 2012,3967,IEI0665896,RISERVATI POESIA.DEVITA 2011(A) ,"*Turning Page cambio di rotta : Esercizi di poesia - versi sparsi e prose / Ugo De Vita. - Roma : Edizioni del Manto, stampa 2011. - 83 p. ; 21 cm",41.9028° N,12.4964° E,Roma,,Roma,30 gennaio 1972,https://drive.google.com/file/d/14BEUHUyX1dP78gbzxeZnZMbyajy8O4F4/view?usp=sharing,
"Del Giudice, Daniele",Ad Elio Pagliarani con stima e amicizia Daniele Del Giudice maggio 1983,3686,RAV0191261,RISERVATI.NARRATIVA.DELGIUDICE.1983(A),"Lo *stadio di Wimbledon / Daniele Del Giudice. - Torino : Einaudi, 1983. - 127 p. ; 20 cm",45.4408° N,12.3155° E,Venezia,,,,https://drive.google.com/file/d/1RXtZwkTc9dXwSBkZiY0gZnkXKpeta6hz/view?usp=sharing,
"Della Casa, Giuliano",Ad Elio Pagliarani Giuliano Della Casa Modena 15-9-1995,4199,RER0017068,RISERVATI CATALOGHICAPPI/DELLACASA 1994(A) ,"*Piccoli dei / Alberto Cappi, Giuliano Della Casa. - Faenza : Circolo degli Artisti, 1994. - [39] c. : ill. ; 30 cm ((Catalogo della Mostra.",44.6471° N,10.9252° E,Modena,,Modena,15 settembre 1995,,
"Di Francesco, Tommaso",In un giorno di sole e di novembre tornando dalla Cina con stima ed affetto Tommaso Di Francesco,3710,CFI0239549,RISERVATI.NARRATIVA.DITOMMASO.1995(A),"*Doppio deserto / Tommaso Di Francesco ; prefazione di Paolo Volponi. - Catania : Pellicanolibri, ©1985. - 83 p. ; 21 cm",41.9028° N,12.4964° E,Roma,,,,https://drive.google.com/file/d/12Oqht9xnH7-53u_grgsQ6rk2LagC4QbC/view?usp=sharing,
"Donati, Alba",Per Elio Pagliarani con un ricordo Alba Donati gennaio '98,4663,RAV0334612,RISERVATI POESIA.DONATI 1997(A) ,"La *repubblica contadina / Alba Donati. - Firenze : City lights italia luci della citta, 1997. - 68 p. ; 20 cm",43.7696° N,11.2558° E,Firenze,,,gennaio 1998,https://drive.google.com/file/d/1ANjpTrNmvtuhvSLNatJuHR7GPdk9vf0o/view?usp=sharing,
"Eco, Umberto",A Elio Pagliarani affettuosamente Umberto Eco,2218,SBL0130843,RISERVATI NARRATIVA.ECO 1963(A) ,"*Diario minimo / Umberto Eco. - Milano : A. Mondadori, 1963. - 169 p. ; 18 cm",45.4408° N,9.1900° E,Milano,,,,https://drive.google.com/file/d/1-YNByqLO8189Nh4gmsm_iF97HrypQJ3u/view?usp=sharing,
"Eco, Umberto",A Elio Umberto,3672,RAV0052397,RISERVATI SAGGISTICA.ECO 1983(A) ,"*Sette anni di desiderio / Umberto Eco. - Milano : Bompiani, 1983. - 304 p. ; 23 cm ((In sopraccoperta: Cronache, 1977-1983.",45.4408° N,9.1900° E,Milano,,,,,
"Eco, Umberto",A Elio Umberto,3712,CFI0097988,RISERVATI NARRATIVA.ECO 1988(A) ,"Il *pendolo di Foucault / Umberto Eco. - \Milano! : Bompiani, 1988. - 509 p. ; 24 cm",45.4408° N,9.1900° E,Milano,,,,https://drive.google.com/file/d/1soWewHtlPTChciu4QeFfcZ7HZdofR6QN/view?usp=sharing,
"Erba, Luciano",A Elio Pagliarani con affettuoso saluto Luciano Erba,583,SBL0516643,RISERVATI POESIA.ERBA 1960(A) ,"Il *male minore / Luciano Erba. - [Milano] : A. Mondadori, 1960. - 80 p. ; 19 cm",45.4642° N,9.1900° E,Milano,,,,https://drive.google.com/file/d/1d-J2YYs_QZKEi9XX255HBx1qELJIvVaA/view?usp=sharing,
"Ferretti, Massimo","Jesi, 25 sett. '65 Pagliarani: per ringraziarlo (anche) d'una  intendenza per questa ""gazzarra"" Ferretti",1654,RAV0059367 ,RISERVATI.NARRATIVA.FERRETTI.1965(A),"Il *gazzarra Romanzo / Ferretti. - Milano : Feltrinelli, 1965. - 189 p. ; 21 cm",41.9028° N,12.4964° E,Roma,,Jesi,settembre 1965,https://drive.google.com/file/d/1xbIWKd8rhSoOVSriA8u8f6NGnKV033mX/view?usp=sharing,
"Ferretti, Massimo ","Jesi, 25 sett. '65 A Pagliarani: per ringraziarlo (anche) d'una  intendenza per questa ""gazzarra"" Ferretti",1654,RAV0059367 ,RISERVATI.NARRATIVA.FERRETTI.1965(A),"Il *gazzarra : Romanzo / Ferretti. - Milano : Feltrinelli, 1965",41.9028° N,12.4964° E,Roma,,Jesi,25 settembre 1965,,
"Ferro, Pier Luigi",Con stima e ammirazione sincere Ferro Pier Luigi (segue indirizzo dell'A.),5189,UBO2166988,RISERVATI POESIA.FERRO 1984(A) ,"*Librido / Pier Luigi Ferro ; [nota critica di A. Spatola]. - [Torino : Geiger], stampa 1984. - 29 p. ; 17 cm ((Seconda responsabilita sulla cop.",44.2976° N,8.4645° E,Savona,,,,https://drive.google.com/file/d/1whPeZdR_zpb6gnSlgiNb3UShX97Oa_tG/view?usp=sharing,
"Ferroni, Giulio","A Elio e Concetta, con un caro saluto Giulio",5038,RAV0313792,RISERVATI.NARRATIVA.FERRONI.1998(A),"La *scena intellettuale : tipi italiani / Giulio Ferroni. - Milano : Rizzoli, 1998. - 221 p. ; 20 cm",41.9028° N,12.4964 E,Roma,,,,,
"Fortini, Franco","Caro Elio, con tanti auguri dal tuo Franco Fortini dicembre 1956",821,TO00705813,RISERVATI POESIA.FORTINI 1956(A) ,"I *destini generali : con uno scritto di poetica / Franco Fortini. - Caltanisetta ; Roma : Sciascia, stampa 1956. - 80 p. ; 17 cm",45.4642° N,9.1900° E,Milano,,,dicembre 1956,https://drive.google.com/file/d/1oRTpayGRttbODLccIlD34P2F5j1cTVWz/view?usp=sharing,
"Franzin, Fabio","A voi carissimi Concetta e Elio, con profonda stima Fabio Franzin Motta di Livenza, 28/1/2010",4664,UBO3701498,RISERVATI POESIA.FRANZIN 2009(A) ,"*Fabrica / Fabio Franzin. - Borgomanero : Atelier, 2009. - 96 p. ; 21 cm ((Testo in dialetto veneto con traduzione italiana a front.",45.7773° N,12.6121° E,Motta di Livenza,,Motta di Livenza,28 gennaio 2010,https://drive.google.com/file/d/1Es-2uyv9_jEOT5g2KLpKJCD5w3pESM1C/view?usp=sharing,
"Frasca, Gabriele","A Elio, con grandissima stima (e grazie della tua presenza all'Orologio) Gabriele",4788,RAV0249265,RISERVATI POESIA.FRASCA 1995(A) ,"*Lime / Gabriele Frasca. - Torino : G. Einaudi, ©1995 (stampa 1994). - 158 p. ; 18 cm",40.7713° N,14.7907° E,Fisciano,,,,https://drive.google.com/file/d/1TyUqf3wX3BAGfECe1Jhgpy3ic0nPXMEu/view?usp=sharing,
"Frassineti, Augusto","A Elio Pagliarani con cara amicizia Augusto Frassineti Roma, 21-3-80",5194,SBL0297295 ,RISERVATI.NARRATIVA.RABELAIS.1980(A),"*Gargantua e Pantagruele / Francois Rabelais ; recato in lingua italiana da Augusto Frassineti. - Firenze : Sansoni, 1980!. - XVIII, 767 p. ; 21 cm",41.9028° N,12.4964° E,Roma,Dedica  del curatore Augusto Frassinelli,Roma,21 marzo 1980,https://drive.google.com/file/d/15XoeEOb6DyaTrRzo1UM9G6hHOUws6wUH/view?usp=sharing,
"Frassineti, Augusto","A Elio Pagliarani con cara amicizia Augusto Frassineti Roma, 21-3-80",5194,SBL0297295,RISERVATI NARRATIVA.RABELAIS 1980(A) ,"*Gargantua e Pantagruele / Francois Rabelais ; recato in lingua italiana da Augusto Frassineti. - Firenze : Sansoni, 1980!. - XVIII, 767 p. ; 21 cm ((Introduzione di Giovanni Macchia.",41.9028° N,12.4964° E,Roma,,Roma,21 marzo 1980,,
"Fratini, Gaio","Elio Pagliarani, purezza magnifica, quanti sono i poeti italiani? Travolse il direttissimo Milano - Roma un novissimo Aberrato ictus, Pasolini sparò a Balestra e colse Balestrini Gaio Fratini 14-7-61",4959,SBL0138483,RISERVATI POESIA.FRATINI 1961(A) ,"Il *re di Sardegna / Gaio Fratini ; con disegni di Vespignani. - Milano : All'insegna del pesce d'oro, [1961]",45.4642° N,9.1900° E,Milano ,,,14 luglio 1961,,
"Frungillo, Vincenzo  ",Al maestro esemplare con riconoscenza illimitata Vincenzo Frungillo,5757,MOD1407356 ,"RISERVATI.POESIA.FRUNGILLO,2007 (A) ","*Ogni cinque bracciate : un estratto : poema in cinque canti (02-02-2002/2006) / Vincenzo M. Frungillo ; disegni di Paola Pezzi. - Modena : Fondazione Cassa di risparmio di Modena, [2007]",40.8518° N,14.2681° E,Napoli,,,,https://drive.google.com/file/d/1zWzPniQF-wDJicxLWMwNeSCCd5aZKJi9/view?usp=sharing,
"Gentiluomo, Paolo",A Elio Pagliarani da un membro dell'orchestrina con approvazione pontificia Paolo Gentiluomo,4794,UM10034911,RISERVATI POESIA.GENTILUOMO 1995(A) ,"*Novene irresistibili / Paolo Gentiluomo. - Cosenza : Periferia, \1995!. - 83 p. ; 20 cm",44.4056° N,8.9463° E,Genova,,,,https://drive.google.com/file/d/1kN-9gmMQDkL2AW6gBxKEc3KfS6wbI1Jd/view?usp=sharing,
"Gerola, Gino","A Elio Pagliarani cordialmente Gino Gerola Firenze, dic. 1982",822,SBL0045028,RISERVATI POESIA.GEROLA 1962(A) ,"La *valle / Gino Gerola. - [Firenze] : Quartiere, stampa 1962. - 55 p. ; 17 cm ((Ed. di 500 esempl. num.",43.7696° N,11.2558° E,Firenze,,Firenze,dicembre 1982,https://drive.google.com/file/d/1mnnaimGkClihZxLSTJ-mWGo2Bm1iN4_-/view?usp=sharing,
"Ginzburg, Natalia","A Carlo, con affetto Natalia Roma 6 aprile",2125,TO00039618  ,RISERVATI.NARRATIVA.GINZBURG.1963(A),"*Lessico famigliare / Natalia Ginzburg. - Torino : Einaudi, [1963]. - 218 p. ; 23 cm",41.9028° N,12.4964° E,Roma,Dedica dell’A. al figlio Carlo,Roma,1963,https://drive.google.com/file/d/1gufS7imrWX8i2ra0TmXmHhZ40leOak3J/view?usp=sharing,
"Giovenale, Marco --- Vitale, Francesca","a Elio Pagliarani, maestro centrale",3614,RML0224692,RISERVATI POESIA.GIOVENALE 2002 (A) ,"*Curvature / Marco Giovenale, Francesca Vitale. - Roma : La Camera Verde, 2002. - 31 p. : Ill. ; 20 cm ((1 op.",41.9028° N,12.4964° E,Roma,,,,,
"Giuliani, Alfredo",A Elio Pagliarani con affetto Alfredo Giuliani Gennaio '61,502,BVE0282064,RISERVATI POESIA.GIULIANI 1955(A) ,"Il *cuore zoppo : con sette versioni da Dylan Thomas / Alfredo Giuliani. - Varese : Magenta, 1955. - 43 p. ; 19 cm",41.9028° N,12.4964° E,Roma,,,gennaio 1961,https://drive.google.com/file/d/1CrdFx6TDhtPQcyABMjpyO7vuete-t0tP/view?usp=sharing,
"Giuliani, Alfredo","Caro Elio, ti dedico il libro con un mottetto: non ti verranno a noia le mie opere complete, staremo in un fazzoletto il tuo Alfredo. Maggio 1986",567,CFI0027628,RISERVATI POESIA.GIULIANI 1986(A) ,"*Versi e nonversi / Alfredo Giuliani. - Milano : Feltrinelli, 1986. - 194 p. ; 20 cm",41.9028° N,12.4964° E,Roma ,,,maggio 1986,https://drive.google.com/file/d/1y1f--bFs2WZdsHWEpoOeB9cgxh0MA9vd/view?usp=sharing,
"Giuliani, Alfredo","Reggio Emilia 28 maggio '94 Al carissimo Elio, augurandoci letizie da Pelle d'asino, mica è il caso di smemorare l'ilarità (con stile si sa) Alfredo",3946,MIL0239902,RISERVATI POESIA.GIULIANI 1993(A) ,"*Ebbrezza di placamenti / Alfredo Giuliani ; introduzione di Romano Luperini. - Lecce : Piero Manni, 1993. - 54 p. ; 22 cm",41.9028° N,12.4964° E,Roma,,Reggio Emilia,28 maggio 1994,,
"Gregotti, Carmen",29/5/98 A Elio Pagliarani Cordialmente Carmen Gregotti,2490,NAP0199629,RISERVATI POESIA.GREGOTTI 1998(A) ,"*Scostamenti / Carmen Gregotti ; con una nota di Arrigo Lora-Totino. - Lecce : P. Manni, stampa 1998. - 52 p. ; 21 cm",45.4642° N,9.1900° E,Milano,,,29 maggio 1998,https://drive.google.com/file/d/1pFKmMpf6RT22H4zJ_uZFRDS_18nZPDwX/view?usp=sharing,
"Guerra, Tonino","A Elio, con un abbraccio affettuoso d'amicizia, di stima Tonino",5261,RAV0164956,RISERVATI POESIA.GUERRA 1972(A) ,"I *bu : poesie Romagnole / Tonino Guerra ; trascrizione in lingua di Roberto Roversi ; introduzione di Gianfranco Contini. - Milano : Rizzoli, 1972. - 180 p. ; 22 cm",41.9028° N,12.4964° E,Roma,,,,https://drive.google.com/file/d/1BdvXGMof2dlWQqWJb7pqtoAj32RcDj4o/view?usp=sharing,
"Guiducci, Armanda","A Elio Pagliarani con vecchia amicizia, affettuosamente 
Armanda Guiducci",4712,SBL0385681,RISERVATI GUIDUCCI 1965(A) ,"*Poesie per un uomo / Armanda Guiducci. - Milano : A. Mondadori, 1965. - 165 p. ; 19 cm",45.4642° N,9.1900° E,Milano,,,,,
