"Mitzù Ruffini, Maddalena",Al poeta Elio Pagliarani mio maestro fuorilegge! Mitzù,5508,BVE0241624,RISERVATI POESIA.MITZU.RUFFINI 2001(A) ,"Il *mondo di Peo : quaranta poesie sugli animali / Maddalena Mitzù Ruffini. - Roma : Palombi, \2001!. - 91 p. : ill. ; 23 cm",41.9028° N,12.4964° E,Roma,,,,https://drive.google.com/file/d/1MIsrqae74n4fn0B1-atcTKcBeRPeMNcb/view?usp=sharing,
"Mura, Stefano","""Casa"" Pagliarani un grande grazie a Petrus Il Mura Roma",3539, 	LIG0291808,RISERVATI POESIA.MURA 2018(A) ,"L'*ordine alfabetico / Stefano Mura. - Genova : Zona, 2018. - 113, [4] p. ; 20 cm",41.9028° N,12.4964° E,Roma,,Roma,,,
"Musa, Gilda",A Elio Pagliarani con amicizia Gilda Musa  1964,4746,SBL0418488,RISERVATI POESIA.MUSA 1964(A) ,"Gli *onori della cronaca : 1961-1962 / Gilda Musa ; prefazione di Giorgio Bàrberi Squarotti. - Caltanissetta ; Roma : S. Sciascia, 1964. - 63 p. ; 17 cm",41.9028° N,12.4964° E,Roma,,,1964,https://drive.google.com/file/d/197VQvpSClriEd-nSHt8fo2nY_sezNKij/view?usp=sharing,
"Niccolai, Giulia",A Elio 25 anni dopo Giulia,606,UBO2137925,RISERVATI ARTE.NICCOLAI 1974(A) ,"*Poema & oggetto / Giulia Niccolai ; [introduzione di Milli Graffi]. - Torino : Geiger, 1974. - 15 p., [23] carte di tav. : ill. ; 23 cm ((Edizione di 400 esemplari numerati. - Testo anche in inglese",44.8015° N,10.3279° E,Parma,,,,,
"Nove, Aldo","A Elio, con gratitudine e affetto Aldo 9.  23-03-03",3731,LO10749564,RISERVATI POESIA.NOVE 2003(A) ,"*Fuoco su Babilonia| : poesie 1984-1996 / Aldo Nove ; a cura di Gemma Gaetani ; introduzione di Elio Pagliarani. - Milano : Crocetti, °2003!. - 147 p. ; 21 cm",45.4642° N,9.1900° E,Milano,,,23 marzo 2003,https://drive.google.com/file/d/12ltSYN5G5KQhyN4MezrcLTqKDFAkPOUQ/view?usp=sharing,
"Nove, Aldo","A Elio, con gratitudine e affetto Aldo 9.  23-03-03",5454,LO10749564,RISERVATI POESIA.NOVE 2003(A)bis ,"*Fuoco su Babilonia| : poesie 1984-1996 / Aldo Nove ; a cura di Gemma Gaetani ; introduzione di Elio Pagliarani. - Milano : Crocetti, °2003!. - 147 p. ; 21 cm",45.4642° N,9.1900° E,Milano,,,23 marzo 2003,https://drive.google.com/file/d/1EUN3dn78Xyu0SdAnSUO4X6BB1OsEChXv/view?usp=sharing,
"Ombres, Rossana",Per Elio caramente Rossana 5-6- '68,671,RAV0052023,RISERVATI POESIA.OMBRES 1968(A) ,"L'*ipotesi di Agar / Rossana Ombres. - Torino : Einaudi, [1968]. - 92 p. ; 18 cm",45.0703° N,7.6869° E,Torino,,,5 giugno 1968,https://drive.google.com/file/d/1ylDKHET6qbctdyeQdS3SPnlDBc4I0BkY/view?usp=sharing,
"Ombres, Rossana","A Elio, poeta e amico Rossana",1694,LIA0226656,RISERVATI NARRATIVA.OMBRES 1980(A) ,"*Serenata : Romanzo / Rossana Ombres. - Milano : A. Mondadori, 1980. - 143 p. ; 21 cm",45.0703° N,7.6869° E,Torino,,,,https://drive.google.com/file/d/1URHYpHCC4dBSGMU3sJWhhv96oOQ_HKC8/view?usp=sharing,
"Ombres, Rossana",A Elio Pagliarani da Rossana Ombres ott. 1962,5271,SBL0042948,RISERVATI POESIA.OMBRES 1962(A) ,"Le *ciminiere di Casale / Rossana Ombres. - Milano : Feltrinelli, 1962. - 122 p. ; 21 cm",45.0703° N,7.6869° E,Torino,,,ottobre 1962,https://drive.google.com/file/d/18JYC_vfBpYhvaWGlZSjhPSA8556Ps5ju/view?usp=sharing,
"Ortesta, Cosimo",A Elio Pagliarani con molta stima e simpatia Cosimo Ortesta Roma 27 luglio 1989,4776,CFI0181357,RISERVATI POESIA.ORTESTA 1988(A) ,"*Nel progetto di un freddo perenne / Cosimo Ortesta. - Torino : G. Einaudi, 1988. - 72 p. ; 18 cm",41.9028° N,12.4964° E,Roma,,Roma,27 luglio 1989,https://drive.google.com/file/d/19dBPP6ynkWk-PKaQmlHsVBOUwp2TcFEQ/view?usp=sharing,
"Oster, Pierre",Pour Elio Pagliarani en hommage Pierre Oster,5498,UTO1062392,RISERVATI POESIA.OSTER 1964(A) ,"La *grande annee : poemes, 1959-1962 / Pierre Oster. - Paris : Gallimard, [1964]. - 110 p. ; 21 cm",48.8566° N,2.3522° E,Paris,,,,,
"Ottiero, Ottieri",A Elio Pagliarani con la stima di Ottiero Ottieri,3695,MOD0038187,RISERVATI.NARRATIVA.OTTIERI.1979(A),"*Di chi e la colpa / Ottiero Ottieri. - Milano : Bompiani, 1979. - 165 p. ; 21 cm",45.4642° N,9.1900° E,Milano,,,,https://drive.google.com/file/d/18N5lZzSqCeDI6TYsLo7QyyK0H9DvkdiM/view?usp=sharing,
"Ottonieri, Tommaso","""a Elio e Cetta un caro abbraccio da Tommaso * *(poi ""Dal vivo"" la dedica sulla copia!)""",3175,RMB0660459,RISERVATI NARRATIVA.OTTONIERI 2007bis ,"Le *strade che portano al Fùcino / Tommaso Ottonieri ; prefazione di Enrico Ghezzi ; guida alla lett. - Firenze : Le Lettere, 2007",41.9028° N,12.4964° E,Roma,,,,https://drive.google.com/file/d/1XihvMHt9Zu2-coeswWACnR2gKsgRq3NP/view?usp=sharing,
"Ottonieri, Tommaso",a Elio flussi ancora da un mio tempo amniolico un grosso abbraccio da Tommaso.,3499,UBO2770225,RISERVATI POESIA.OTTONIERI 2003 (A) ,"*Coro da l'acqua per voce sola / Tommaso Ottonieri. - Napoli, d'if, [2003]. - 47 p. ; 17 cm",41.9028° N,12.4964° E,Roma,,,,https://drive.google.com/file/d/1f0tooiqvKvo19hRkKxfPbMw3D3yrP9u7/view?usp=sharing,
"Ottonieri, Tommaso","a Elio e Cetta e Lia Rosa, ancora da un jukebox commerciale ancora più schizzato (e mai lontanamente degno della grande balera riminese) con affetto Tommaso",3605,CFI0483513,RISERVATI NARRATIVA.OTTONIERI 2000 (A) ,"L'*album Crèmisi / Tommaso Ottonieri. - Roma : Empirìa, \2000!. - 118 p. ; 21 cm",41.9028° N,12.4964° E,Roma,,,,https://drive.google.com/file/d/10lNgOG33v7LjmxaSIU2NiDiOEgjRNCK9/view?usp=sharing,
"Ottonieri, Tommaso","A Elio e a Cetta, e Lia Rosa, questi contatti (ed. omaggi in mancette) con grande affetto Tommaso",3941,BVE0296637,RISERVATI POESIA.OTTONIERI 2002(A) ,"*Contatto / Tommaso Ottonieri. - Napoli : Cronopio, \2002!. - 126 p. ; 19 cm",41.9028° N,12.4964° E,Roma,,,,https://drive.google.com/file/d/1pDKTuaqrHsl8piDH2W8QX8Lv09-EB0dW/view?usp=sharing,
"Ottonieri, Tommaso","A Elio al cui Rudi (e Nandi, e ...) avrei davvero dovuto dedicare questo libro, con affetto Tommaso",5132,FER0169535,RISERVATI POESIA.OTTONIERI 1998(A) ,"*Elegia sanremese / Tommaso Ottonieri ; prefazione di Manlio Sgalambro ; con undici tavole di Pablo Echaurren. - Milano : Bompiani, 1998. - V, 85 p. : ill. ; 16 x 16 cm + 1 compact disc.",41.9028° N,12.4964° E,Roma,,,,https://drive.google.com/file/d/1h77ACC6hfC4Jp-MbMxVp-AMj6oXkfJcm/view?usp=sharing,
"Ottonieri, Tommaso","A Elio Pagliarani che ritroverà qui il suo Rudi, da qualche parte, con vera stima e affetto Tommaso Ottonieri",3607,VEA0094775,RISERVATI.NARRATIVA.OTTONIERI.1997(A),"*Crema acida / Tommaso Ottonieri. - \Milano! : Lupetti ; Lecce : P. Manni, \1997!. - 177 p. ; 20 cm.",41.9028° N,12.4964° E,Roma,,,,https://drive.google.com/file/d/16aGX7bOo547GXJoygqN67Fb4LfqWL_hM/view?usp=sharing,
"Pagliarani, Elio ",Stefano sei dei miei Signori o negli anarchici che ammiro da sempre! Elio,5477,LO10367625 ,RISERVATI.POESIA.PAGLIARANI.1995(A),"La *ballata di Rudi / Elio Pagliarani. - Venezia : Marsilio, 1995",41.9028° N,12.4964° E,Roma,,,,,
"Pagliarani, Elio ","Ad Alberto Asor Rosa che non ho ringraziato almeno in proporzione per il suo fondamentale saggio sul mio lavoro. Questi versi mondani in attesa dell' ""ultimo paradosso"" il suo Elio Pagliarani Roma maggio '85",5478,CFI023284 ,RISERVATI.POESIA.PAGLIARANI.1975(A),"*Esercizi platonici / di Elio Pagliarani ; con dodici disegni di Ettore Sordini. - Palermo : Acquario-La Nuova Guanda, [1985]",41.9028° N,12.4964° E,Roma,,Roma,maggio 1985,https://drive.google.com/file/d/10X2THYHFVkA75qhe3-FtUa80SADpLYoU/view?usp=sharing,
"Pagliarani, Elio ",A Lamberto Pignotti con viva cordialità in cambio del suo fermento Elio Pagliarani Milano 8 febbraio '59,4109,SBL0506895 ,RISERVATI.POESIA.PAGLIARANI.1959(A),"*Inventario privato / Elio Pagliarani ; prefazione di Giacomo Zanga ; disegni di Alberto Casarotti. - Milano : Veronelli, stampa 1959",45.4642° N,9.1900° E,Milano,,Milano,8 febbraio 1959,https://drive.google.com/file/d/1wLtaItcyJp0JKRIFRIvX9DJ__88MxAfx/view?usp=sharing,
"Palazzi, Roberto",per Elio Pagliarani dal suo Roberto Palazzi,5140,LO11125021,RISERVATI SAGGISTICA.PALAZZI 1992(A) ,"*Note azzurre ""Blue notes"" / Carlo Dossi ; [a cura di] Roberto Palazzi. - [S.l.] : Il Topo, stampa 1992 (Sainte-Savine : Covam). - [12] p. : ill. ; 23 cm ((Ed. f.c. di 100 esempl. num.",41.9028° N,12.4964° E,Roma,,,,,
"Palladini, Marco",A Elio Pagliarani con ammirazione Marco Palladini  Aprile '95,4743,VIA0396595,RISERVATI POESIA.PALLADINI 1995 ,"*Ovunque a novunque / Marco Palladini ; [prefazione di Gaetano Delli Santi]. - Udine : Campanotto, 1995. - 124 p. ; 19 cm",41.9028° N,12.4964° E,Roma,,,aprile 1995,https://drive.google.com/file/d/1CuXf_jW5CkNicW4g6IhwieJwEBoUXqQ4/view?usp=sharing,
"Panaccione, Annarosa",A Elio Pagliarani per la sua concentrata e svagata cortesia Annarosa Panaccione Roma 10.4.63,4787,SBL0142007,RISERVATI POESIA.PANACCIONE 1963(A) ,"Il *garofano spagnolo. - Roma : Ediz. Babuino, [1963?]. - 81 p. ; 21 cm ",41.9028° N,12.4964° E,Roma,,Roma,10 aprile 1963,https://drive.google.com/file/d/18rvYMnN_JNMGlLEOfKl5Nc3LDdayRljk/view?usp=sharing,
"Papa, Marco",A Concetta ed Elio Pagliarani con affetto e stima Marco luglio 1986,5427,RML0073375,RISERVATI POESIA.PAPA 1986(A) ,"Le *birre sonnambule / Marco Papa. - Reggio Emilia : Aelia Laelia, ©1986. - 139 p. ; 17 cm",45.4642° N,9.1900° E,Milano,,,luglio 1986,https://drive.google.com/file/d/1Cxm9eIyl4fKILGBLD2lSrZ4h3CSs0q4d/view?usp=sharing,
"Papa, Marco ",Ad Elio e Cetta Pagliarani con affetto e stima Marco Papa giugno '89,3653,CFI0193743 ,RISERVATI.NARRATIVA.PAPA/CAPACCIO.1989(A),"La *guerra / Marco Papa, Antonio Capaccio. - Roma : Empiria, stampa 1989",45.4642° N,9.1900° E,Milano,,,giugno 1989,https://drive.google.com/file/d/1oq-zDkYhpM8Z4Tq9tAFLfZKJV8vz6XEE/view?usp=sharing,
"Papa,Marco ",A Elio e Concetta un caro saluto Marco marzo 2004,5530,BVE0384597 ,RISERVATI.POESIA.PAPA.2004(A),"*Chiesto ancora / Marco Papa. - Roma : Empirìa, ©2003 (stampa 2004)",45.4642° N,9.1900° E,Milano,,,marzo 2004,https://drive.google.com/file/d/151HHgXnrDU-4LdqAziAopv5Qx1cajlj3/view?usp=sharing,
"Pasolini, Pierpaolo",A Elio Pagliarani affettuosamente Pier Paolo Pasolini.,2247, 	SBL0131954,RISERVATI SAGGISTICA.PASOLINI 1960(A) ,"*Passione e ideologia : (1948-1958) / Pier Paolo Pasolini. - Milano : Garzanti, ©1960. - 495 p. ; 22 cm ((Raccolta di saggi già pubblicati in varie riviste",44.4949° N,11.3426° E,Bologna,,,,https://drive.google.com/file/d/1OMbK555T0rO8OUTE1QXGLSZTCjjP0U57/view?usp=sharing,
"Pecora, Elio",A Elio e Cetta dal loro amico Elio gennaio '98,5267,RML0067349,RISERVATI POESIA.PECORA 1997(A) ,"*Poesie : 1975-1995 / Elio Pecora. - Roma : Empiria, [1997]. - 273 p. : 1 ritr.  ; 21 cm",44.3713° N,9.8816° E,"Pontremoli, Tuscany",,,gennaio 1998,https://drive.google.com/file/d/1fAj-n3J9hnv2vkFovuMeMIgCCBTcW0ej/view?usp=sharing,
"Penna, Sandro","Roma, 3 giugno '70 A Elio Pagliarani, poeta senza aggettivi, il suo Sandro Penna",644,SBL0365904,RISERVATI POESIA.PENNA 1970(A) ,"*Tutte le poesie / Sandro Penna. - Milano : Garzanti, 1970. - 364 p. ; 22 cm",41.9028° N,12.4964° E,Roma,,Roma,3 giugno 1970,https://drive.google.com/file/d/1UE0R3ceHTpFTUf8oLKl3jTc2JoTGMzq6/view?usp=sharing,
"Perilli, Plinio","Ad Elio Pagliarani e alla sua cara Cetta, un abbraccio e poesia: qui prega il mio cuore. Con tanto affetto il loro Plinio Roma, 3 novembre '94",3689,CFI0283537,RISERVATI.POESIA.PERILLI.1994(A),"*Preghiere d'un laico (1980-1993) / Plinio Perilli. - Cittadella : Amadeus, stampa 1994. - 199 p. ; 20 cm",41.9028° N,12.4964° E,Roma,,Roma,novembre 1994,https://drive.google.com/file/d/1m98JnxCQN7CQWUzNaE5vaNArcco7Yuri/view?usp=sharing,
"Petrova, Alexandra","Ad Elio, le cose pirotecniche dalla ragazza Sasha con a,  9.12.2005  Roma",2486,LIG0022213,RISERVATI POESIA.PETROVA 2005 LIG0022213,"*Altri fuochi / Alexandra Petrova ; traduzione di Pietro Alessandrini. - Milano : Crocetti, [2005]. - 140 p. ; 20 cm ((Testo orig. a fronte.",41.9028° N,12.4964° E,Roma,,Roma,9 dicembre 2005,https://drive.google.com/file/d/1hK1Ui7Ub93uCZSOvgefqpDfTt8bzWQdZ/view?usp=sharing,
"Piccioli, Gian Luigi","A Elio, cordialmente con amicizia e stima Gian Luigi Roma 12-5-79",4779,UPG0012383,RISERVATI NARRATIVA.PICCIOLI 1979(A) ,"*Sveva : Romanzo / Gian Luigi Piccioli. - Milano : Rusconi, 1979. - 324 p. ; 22 cm",45.4642° N,9.1900° E,Milano,,Roma,12 maggio 1979,https://drive.google.com/file/d/1C--grasKEBO-UXgrzclHyjyfCXHhmQ6h/view?usp=sharing,
"Piccioli, Gian Luigi","A Elio Pagliarani, con stima e amicizia Gian Luigi Piccioli Roma, 1-5-2000",5263,CFI0482678,RISERVATI NARRATIVA.PICCIOLI 2000(A) ,"L'*erba di Auschwitz cresce altrove / Gian Luigi Piccioli. - Roma : ARLEM, \2000!. - V, 77 p. ; 21 cm",41.9028° N,12.4964° E,Roma,,Roma,1 maggio 2000,https://drive.google.com/file/d/1l6Qkkw9dW4aMxLOJo1obPnCnDjlg-POX/view?usp=sharing,
"Pieroni, Daniele",A Cetta e Elio Pagliarani con stima e cordialità Daniele Pieroni settembre 2003,5507,BVE0321985,RISERVATI NARRATIVA.PIERONI 2003(A) ,"*Prose / Daniele Pieroni. - [Roma! : M. Massaioli, stampa 2003. - 117 p. ; 16 cm",33.6846° N,117.8265° W,"Irvine, California",,,settembra 2003,,
"Pierro, Albino",A Elio Pagliarani con la più viva cordialità Albino Pierro,4749,SBL0252027,RISERVATI POESIA.PIERRO 1963 ,"*Metaponto / Albino Pierro ; [premessa di Fernando Figurelli]. - Roma : "" Il nuovo Cracas"", 1963. - 109 p. ; 16 cm",41.9028° N,12.4964° E,Roma,,,,https://drive.google.com/file/d/1qrbK0NcQdoeqU1mQq1YvLcfyjAtricsI/view?usp=sharing,
"Pierro, Albino",A Elio Pagliarani cordialmente albino Pierro 6 marzo 1965,4791,IEI0084694,RISERVATI POESIA.PIERRO 1963(A) ,"I '*nnammurète / Albino Pierro ; [premessa di Umberto Bosco]. - Roma : ""Il nuovo Cracas"", 1963. - 94 p. ; 16 cm ((Ed. di 1000 esempl.",41.9028° N,12.4964° E,Roma,,,6 marzo 1965,https://drive.google.com/file/d/17yHtiP9lk-8W7FS6Ulf2TFerDRSL4iq9/view?usp=sharing,
"Pierro, Albino","Per Elio Pagliarani cordialmente Albino Pierro Roma, 15-X-'73",5045,SBL0465976,RISERVATI POESIA.PIERRO 1973(A) ,"*Curtelle a lu soue : poesie in dialetto lucano / Albino Pierro ; con traduzione italiana dell'autore e una lettera di Gianfranco Contini. - Bari : Laterza, 1973. - 79 p. ; 19 cm",41.9028° N,12.4964° E,Roma,,Roma,15 ottobre 1973,,
"Pierro, Albino","Per Aldo (!) Pagliarani cordialmente Albino Pierro Roma, 14-5-71",5533,SBL0357452,RISERVATI POESIA.PIERRO 1971(A) ,"*Famme dorme : poesie in dialetto lucano e traduzione italiana dell'autore / Albino Pierro ; con uno. - Milano : All'insegna del pesce d'oro, 1971",41.9028° N,12.4964° E,Roma,,Roma,14 maggio 1971,https://drive.google.com/file/d/1Ek0_Dzr3KyYt5_bYijLoRR1ZmrAjVeOz/view?usp=sharing,
"Pignotti, Lamberto","A Elio con l'affetto del suo Lamberto Firenze, maggio '65",3076,BVE0636973,RISERVATI POESIA.PIGNOTTI 1984(A) ,"*Storia antica / Lamberto Pignotti ; tre acqueforti di Giuseppe Guerreschi. - [S.l. : s.n.], 1984 (Urbino : Istituto statale d'arte)",43.7696° N,11.2558° E,Firenze,,Firenze,maggio 1965,https://drive.google.com/file/d/1d-Rgdy9VdSZ9WWJtA3pmC-f-96dZFGTB/view?usp=sharing,
"Pignotti, Lamberto",a Cetta a Elio con antica sempreverde amicizia Lamberto,3164,CFI0751180,RISERVATI MOSTRE.PIGNOTTI 2010(A) ,"*Lamberto Pignotti: Ad arte : disegni e poesie visive dagli anni '40 ad oggi. - Livorno : Galleria Granelli, 2010. - 63 p., 1 ritratto : ill. ; 24 cm ((Catalogo della Mostra tenuta a Livorno nel 2010",41.9028° N,12.4964° E,Roma,,,,,
"Pomilio, Tommaso","a Elio e Cetta e Lia Rosa, stanotte in orlonimo (ma asimmetrico non meno), con affetto Tommaso.",3606,MIL0572072,RISERVATI SAGGISTICA.POMILIO 2002 (A) ,"*Asimmetrie del due : di alcuni motivi scapigliati / Tommaso Pomilio. - Lecce : Piero Manni, [2002]. - 187 p. ; 20 cm",41.9028° N,12.4964° E,Roma,,,,,
"Pomodoro, Arnaldo --- Pomodoro, Giò","A Pagliarani ""COMPAGNO"" di corso al R. Valtrud con tanta amicizia Arnaldo; La dedica è nel disegno Giò",5437,LO10849726,RISERVATI ARTE.BALLO 1962(A) ,"*Dalla poetica del segno alla presenza continua : Arnaldo e Giò Pomodoro / [Guido Ballo!. - [S.l.! : Luigi Maestri, 1962. - 78 p., 22 p. di tav. : ill. ; 24 cm",45.4642° N,9.1900° E,Milano,Dediche di Arnaldo e Gio Pomodoro a Elio Pagliarani,,,,
"Pontiggia, Giuseppe","A Elio Pagliarani dal tuo Peppo Pontiggia Milano, 13 aprile 1989",183,RAV0041943,RISERVATI NARRATIVA.PONTIGGIA 1989(A) ,"La *grande sera : Romanzo / Giuseppe Pontiggia. - Milano : A. Mondadori, 1989. - 317 p. ; 22 cm",45.4642° N,9.1900° E,Milano,,Milano,13 aprile 1989,https://drive.google.com/file/d/1azgY1JnFBzjsjbiUBMeVVrarksIFNt65/view?usp=sharing,
"Pontiggia, Giuseppe",A Elio con il mio abbraccio Peppo,2403,LO10315845,RISERVATI NARRATIVA.PONTIGGIA 1993(R) ,"*Vite di uomini non illustri / Giuseppe Pontiggia. - Milano : A. Mondadori, 1993. - 304 p. ; 23 cm",45.4642° N,9.1900° E,Milano,,,,https://drive.google.com/file/d/1UvlKPsLFECxHnCkOY5cWhq2TchL6rw73/view?usp=sharing,
"Pontiggia, Giuseppe","A Elio dal suo Peppino Milano, 22-3-1983",5714, CFI0000600,RISERVATI.NARRATIVA.PONTIGGIA.1983bis(A),"Il *raggio d'ombra : Romanzo / Giuseppe Pontiggia. - Milano : A. Mondadori, 1983. - 172 p. ; 21 cm",45.4642° N,9.1900° E,Milano,,Milano,22 marzo 1983,,
"Porta, Antonio",A Elio Pagliarani da Antonio Porta 7.4.64,479,SBL0260336,RISERVATI POESIA.PORTA 1964(A) ,"*Aprire / Antonio Porta. - Milano : All'insegna del pesce d'oro, 1964. - 39 p. ; 12 c. (( Ed. di 500 esempl. num. .",45.4642° N,9.1900° E,Milano,,,7 aprile 1964,https://drive.google.com/file/d/17aZEuIc5A0ZM_B3jxlien5CB-ngYb585/view?usp=sharing,
"Porta, Antonio",Milano 10.3.1988 A Elio da Leo (Antonio Porta),5054,RAV0026143,RISERVATI POESIA.PORTA 1988(A) ,"Il *giardiniere contro il becchino / Antonio Porta. - Milano : A. Mondadori, 1988. - 91 p. ; 22 cm",45.4642° N,9.1900° E,Milano,,Milano,10 marzo 1988,https://drive.google.com/file/d/1oPgc4AEeu7UZ1SdAkEeVlvSCtSxevbyK/view?usp=sharing,
"Quintavalla, Maria Pia","Con profonda stima ed affetto. Grazie  Maria Pia Quintavalle Milano, 30/5/84",5048,LO10504722,RISERVATI POESIA.QUINTAVALLA 1984(A) ,"*Cantare semplice / Maria Pia Quintavalla ; [nota di Livia Candiani]. - [Torino : Geiger], stampa 1984. - 28 p. ; 17 cm",45.4642° N,9.1900° E,Milano,,Milano,30 maggio 1984,https://drive.google.com/file/d/1_d4K1PuOZvjG87MPlgcJKTui1YmCNyaF/view?usp=sharing,
"Quintavalla, Maria Pia","A Elio Pagliarani, stanze che comunicano con molte di poesia - altre e spero, generative di altro ancora Grazie, M. Pia Quintavalla",5128,LO10414155,RISERVATI POESIA.QUINTAVALLA 1996(A) ,"Le *moradas : poesie, 1988-1994 / Maria Pia Quintavalla. - Roma : Empirìa, [1996]. - 64 p. ; 21 cm",45.4642° N,9.1900° E,Milano,,,,,
"Raboni, Giovanni","A Elio Pagliarani, con l'affetto e la stima del tuo Raboni 27 aprile 1966",4742,SBL0544049,RISERVATI POESIA.RABONI 1966 ,"Le *case della Vetra / Giovanni Raboni. - Milano : Mondadori, 1966. - 108 p. ; 20 cm",45.4642° N,9.1900° E,Milano,,,27 aprile 1966,https://drive.google.com/file/d/1Unvfl5-9kywFHyXz9Y6kAhSgIBEOz5T3/view?usp=sharing,
"Raboni, Giovanni","A Elio con affetto, Raboni 17/5/75",5051,SBL0576698,RISERVATI POESIA.RABONI 1975(A) ,"*Cadenza d'inganno / Giovanni Raboni. - Milano : A. Mondadori, 1975. - 131 p. ; 20 cm",45.4642° N,9.1900° E,Milano,,,17 maggio 1975,https://drive.google.com/file/d/1VOfm_evkXgaA03kseMf6-umegrPLxIN7/view?usp=sharing,
"Raveggi, Alessandro",16/07/03 A Elio Pagliarani Alessandro Raveggi,2487,RAV1665040,RISERVATI TEATRO.RAVEGGI. 2003(A) ,"A *party, a song for Leo : *Doppelganger / Alessandro Raveggi ; introduzione di Simona Maggiorelli ;. - Corazzano [San Miniato] : Titivillus, [2003]",43.7696° N,11.2558° E,Firenze,,,16 luglio 2003,,
"Reale, Ugo",A Cetta ed Elio Pagliarani con viva cordialità e stima Ugo Reale 31/V/83,1678,RAV0187812,RISERVATI VARIA.BIOGRAFIE. REALE ,"*Vita di Cola di Rienzo / Ugo Reale. - Roma : Editori riuniti, 1982. - 268 p. ; 22 cm",41.9028° N,12.4964° E,Roma,,,31 maggio 1983,,
"Riba, Charles",A Elio con affettuosa amicizia,4653,SBL0158044,RISERVATI POESIA.RIBA 1977(A) ,"*Elegie di Bierville / Carles Riba ; introduzione e traduzione di Giuseppe E. Sansone. - Torino : G. Einaudi, 1977. - XXIII, 62 p. ; 18 cm ((Testo orig. a fronte.",41.9028° N,12.4964° E,Roma,,,,https://drive.google.com/file/d/1_UcFLDuAlqf1cH1VnW25n-MFEJ6xFsWO/view?usp=sharing,
"Riccardi, Antonio",A Elio con stima e affetto Antonio,4790,RAV1208274,RISERVATI POESIA.RICCARDI 2004(A) ,"Gli *impianti del dovere e della guerra / Antonio Riccardi. - Milano : Garzanti, 2004. - 91 p. ; 22 cm",45.4642 N,9.1900° E,Milano,,,,https://drive.google.com/file/d/1YvqlXO9SpPgOSklNOzWB8KqPfv5Hqdia/view?usp=sharing,
"Risi, Nelo","A Elio Pagliarani con viva simpatia Nelo Risi Roma, 1958",841,SBL0488827,RISERVATI POESIA.RISI 1958(A) ,"*Civilissimo / Nelo Risi. - Milano : All'insegna del pesce d'oro, [1958]. - 62 p. ; 18 cm ((Ed. di 500 esempl. num.",41.9028 N,12.4964 E,Roma,,Roma,1958,,
"Risi, Nelo ",A Elio Pagliarani con viva simpatia dal suo Nelo Risi 1957,614,CUB0352245 ,RISERVATI.POESIA.JOUVE.1957(A),"*Poesie / Pierre Jean Jouve ; a cura di Nelo Risi ; con una presentazione di Ungaretti. - Roma : Carucci, stampa 1957",41.9028 N,12.4964 E,Roma,Dedica del curatore Nelo Risi,,1957,https://drive.google.com/file/d/1SFeVDL4ESRYVQAsMtr2o6nXi0oo33Gf5/view?usp=sharing,
"Risset, Jacqueline","Per Elio, con affetto questo Dante francese, Jaqueline",1643,LO1050607,"RISERVATI,POESIA.DANTE.1988(A)","Le *Purgatoire / Dante. - Paris : Flammarion, ©1988. - 342 p. ; 23 cm ((Testo orig. a fronte.",41.9028 N,12.4964 E,Roma,dedica del traduttore Jacqueline Risset,,,,
"Riviello, Lidia","Con Ammirazione ... Ad Elio a Cetta, a Lia, perchè i racconti in poesia sono la ""MARAVIGLIA"" quella via, perchè ""lunga la foglia, stretta la via ... dite la vostra, altrimenti non posso dire la mia! Infinitamente Lidia",5136,RMS2677483,RISERVATI.NARRATIVA.RIVIELLO.2002(A),"L'*infinito del verbo andare : racconti / Lidia Riviello. - Roma : Arlem, 2002. - 110 p. ; 17 cm",41.9028 N,12.4964 E,Roma,,,,https://drive.google.com/file/d/1TqiNDaDnpuf-TAjthkFYkpedwZIBS5xk/view?usp=sharing,
"Rosselli, Amelia ",A Elio e Cetta ottimi amici,3665,CFI0053502 ,RISERVATI.POESIA.ROSSELLI.1981(A),"*Impromptu / Amelia Rosselli. - Genova : S. Marco dei Giustiniani, 1981",41.9028 N,12.4964 E,Roma,,,,https://drive.google.com/file/d/1UDdo-gihg3XvxTXs2h1PKIliKa_XQTt4/view?usp=sharing,
"Roversi, Roberto",A Elio Pagliarani dal suo Roberto Roversi 17 aprile 1962,554,LO10086436,RISERVATI POESIA.ROVERSI 1962(A) ,"*Dopo Campoformio : poemetti / Roberto Roversi. - Milano : Feltrinelli, 1962. - 249 p. ; 21 cm",44.4949 N,11.3426 E,Bologna,,,aprile 1962,,
"Roversi, Roberto","A Elio Pagliarani, con affetto dal suo Roberto Roversi 18 febbr. '65",727,SBL0417295,RISERVATI POESIA.ROVERSI 1965(A) ,"*Dopo Campoformio / Roberto Roversi. - Torino : G. Einaudi, c1965. - 116 p. ; 18 cm",44.4949 N,11.3426 E,Bologna ,,,18 febbraio 1965,https://drive.google.com/file/d/1HkzCkK9YOSohkzu3h88twsF7mqBVXjtT/view?usp=sharing,
"Roversi, Roberto",All'amico Elio Pagliarani con l'affetto del suo Roberto Roversi 3 giugno 1964,3664,SBL0265671,RISERVATI NARRATIVA.ROVERSI 1964(A) ,"*Registrazione di eventi / Roberto Roversi. - Milano : Rizzoli, [1964]. - 203 p. ; 23 cm",44.4949 N,11.3426 E,Bologna,,,3 giugno 1964,,
"Roversi, Roberto",Con un caro saluto da Roberto gennaio' 70,874,BRI0495238,RISERVATI.POESIA.ROVERSI.1969(A),"Le *descrizioni in atto : (1963-1969) / Roberto Roversi. - Bologna : [s.n.], 1969. - 1 v. (c. anopist.) ; 27 cm",44.4949 N,11.3426 E,Bologna,,,gennaio 1970,https://drive.google.com/file/d/1cYzOdHbsOj4aZGPsb-ZmFyudjwF0yt30/view?usp=sharing,
"Russo, Giovanni","A Elio ricordando le nostre serate da Cesaretto, con affetto Giovanni Roma 30-5-2002",3640,UBO1310600,RISERVATI POESIA.RUSSO 2001(A) ,"Le *olive verdi : racconti dal Sud / Giovanni Russo. - Milano : Libri Scheiwiller, \2001!. - 168 p. ; 17 cm",41.9028 N,12.4964 E,Roma,,Roma,30 maggio 2002,https://drive.google.com/file/d/1DRQD8fumdfXwMgBWU4OKmsqnaMBdII1V/view?usp=sharing,
"Sabbietti, Rosa",A Elio Pagliarani la mia alta stima con la speranza di recensione Rosa  Berti Sabbietti,5127,CFI0214535,RISERVATI.POESIA.BERTI.SABIETTI.1992(A),"I *passi del tempo / Rosa Berti Sabbieti ; prefazione di Vittoriano Esposito. - Spinea : Edizioni del Leone, [1992]",41.9028 N,12.4964 E,Roma,,,,https://drive.google.com/file/d/1uYiqYZwiozLJOqFsCKCBsU5Ta3nG2RFO/view?usp=sharing,
"Sarra, Gianna","A Cetta, (con Elio) ""dorma con il cuore"" da Gianna",2449,RML0088513,RISERVATI POESIA.SARRA 1992(A) ,"Lo *specchio la pietra il pettine : 1986-87 / Gianna Sarra ; nota di Giorgio Weiss. - [Quarto] : Terra del fuoco, 1992. - 62 p. : ill. ; 21 cm (( Suppl. al n. 15/16/17 di ""Terra del fuoco"".",41.9028 N,12.4964 E,Roma,,,,https://drive.google.com/file/d/1snL1PVyKLuxHwE--F2dtTPJul9YHLTa7/view?usp=sharing,
"Sarra, Gianna","A Elio, maestro d'arte e di vita a Cetta, madrina di poesia con gratitudine Gianna marzo '89",687,IEI0694839,RISERVATI.POESIA.SARRA.1998(A),*Bianco su nero : poesie 1984-1986 / Gianna Sarra ; prefazione di Achille Serrao ; tre acqueforti di Bruno Canova. - Roma : Rossi,41.9028 N,12.4964 E,Roma,,,marzo 1989,https://drive.google.com/file/d/1J1oe1SyEs9H6GjAKBHMoXtgR55EK5n9r/view?usp=sharing,
"Scaglia, Franco","A Elio Pagliarani con moltissima stima e simpatia sperando che questo ""Romanzo"" gli piaccia Franco Scaglia",3670,SBL0599075,RISERVATI NARRATIVA.SCAGLIA 1973(A) ,"*Ritrevacos : Romanzo / Franco Scaglia. - Venezia ; Padova : Marsilio, 1973. - 180 p. ; 21 cm .",41.9028 N,12.4964 E,Roma,,,,https://drive.google.com/file/d/1JpfVVs-7B3nCe7XdViDIx7JQgdr0PtAV/view?usp=sharing,
"Scalise, Gregorio",Con stima Bologna 8 luglio 1961 Gregorio Scalise,792,SBL0104498,RISERVATI POESIA.SCALISE 1968(A) ,"*A capo / Gregorio Scalise. - Bologna : Geiger, 1968. - \17! c. : ill. ; 17x17 cm ((Disegni di William Xerra",44.4949 N,11.3426 E,Bologna,,Bologna,8 luglio 1961,https://drive.google.com/file/d/1DJN8UWdDFwu56h9-sNSIZpi9VwH-0O7-/view?usp=sharing,
