Dedicante,Testo Dedica,Inventario,BID,Collocazione,Descrizione,Latitude,Longitude,Citta dell'autore,Note,Città di Scritta Dedica,Data,Link,n Record
"Accolla, Giovanni Francesco","A Elio Pagliarani, all'unico poeta tanto poeta, il solo maestro, con tutta l'amorevole ammirazione di cui sono capace. Francesco Accolla Roma giugno '91 (segue indirizzo)",5192,CFI0185736,RISERVATI POESIA.ACCOLLA 1991(A) ,"Il *dubbio e l'inautentico : 1988-1990 / Giovanni Francesco Accolla ; prefazione di Stefano Giovanardi. - \Spinea! : Edizioni del Leone, ©1991. - 60 p. ; 20 cm",41.9028 N,12.4964 E,Roma,,Roma,giugno 1991,https://drive.google.com/file/d/18ptU9pmbennDwABunyDSvS1IYLuwFEsJ/view?usp=sharing,
"Accrocca, Elio Filippo",A Elio Pagliarani con i saluti di Elio Fil Accrocca,4654,RLZ0306651,RISERVATI POESIA.ACCROCCA 1965(A) ,"*Roma paesaggio e poesia / Elio Filippo Accrocca. - Roma : Canesi, 1965. - 199 p. : ill. ; 25 cm ((Raccolta di poesie di autori vari",41.4622 N,15.5446 E,Foggia,,,,https://drive.google.com/file/d/17r851GvV6IqcMzxH4hqo9rZC2q-tzzjj/view?usp=sharing,
"Albertazzi, Ferdinando",Per Elio Pagliarani da Ferdinando Albertazzi  25-1- '72,4952,SBL0429640,RISERVATI SAGGISTICA.ALBERTAZZI 1971(A) ,"*Andre Breton, un uomo attento / a cura di Ferdinando Albertazzi. - Ravenna : Longo, stampa 1971. - 213 p. : ill. ; 21 cm ((Scritti di vari.",45.0703 N,7.6869 E,Turin,,,25 gennaio 1972,,
"Alberti, Barbara","A Elio Pagliarani che mi ha fatto felice (si ricorda la mia farsa?) con una critica tutta negativa, perchè non mi ha trattato con sufficienza (così così) come donna, ma stroncandomi ha affermato una rarità. Sarei contenta se questo mio libro le piacesse più del lavoro teatrale, e non in ossequio alla sua condizione di critico, ma perchè voglio comunicare con gli uomini. Barbara Alberti Milano, 14.5.76",3680,SBL0591897,RISERVATI.NARRATIVA.ALBERTI.1976(A),"*Memorie malvage / Barbara Alberti. - Venezia : Marsilio, 1976. - 140 p. ; 20 cm",41.9028 N,12.4964 E,Roma,,Milano,14 maggio 1976,https://drive.google.com/file/d/10nQFVemszTvQYRF3AICfTqB0MFTzsY8c/view?usp=sharing,
"Albisani, Sauro","A l'Antico Fattor, 25 ottobre 2007 A Elio, che mi ha insegnato a usare la cimosa per cancellare l'io dalla lavagna della poesia. (Erano i tempi di via Margutta) Con gratitudine e affetto, Sauro",5117,BVE0286292,RISERVATI POESIA.ALBISANI 2002(A) ,"*Terra e cenere / Sauro Albisani ; con uno scritto di Luigi Baldacci. - Roma : Il labirinto, 2002. - 132 p. ; 21 cm",43.7696 N,11.2558 E,Firenze,,,25 ottobre 2007,https://drive.google.com/file/d/1wwccL7PZvfjojfpMxhieKlxoUwRk7kLY/view?usp=sharing,
"Albisani, Sauro",A Elio con molto affetto e con tutta la mia ammirazione Sauro,5430,CFI0159574,RISERVATI TEATRO.ALBISANI 1987(A) ,"*Campo del sangue / Sauro Albisani. - Firenze : Vallecchi, \1987!. - 302 p. ; 21 cm",43.7696 N,11.2558 E,Firenze,,,,https://drive.google.com/file/d/1ZlbxPR7URv6--PAFCjLIRUMFPJIBH8Ub/view?usp=sharing,
"Amodio, Luciano",Una lezione di storia della ragazza Rosa ad un professore di fisica sconsiglio con affetto Luciano,5193,IEI0070525,RISERVATI SAGGISTICA.AMODIO 1963(A) ,"*Scritti scelti / Rosa Luxemburg ; a cura di Luciano Amodio. - Milano : Avanti|, 1963. - 716 p., [10] p. di tav. : ill. ; 23 cm",45.4642 N,9.1900 E,Milano,,,,https://drive.google.com/file/d/1JIZYRTiYq-PtZ_Ng31pPTbs71kvpDVAl/view?usp=sharing,
"Amodio, Luciano",Una lezione di storia della ragazza Rosa ad un professore di fisica sconsiglio con affetto Luciano,5193, IEI0070525,RISERVATI.SAGGISTICA.LUXEMBURG.1963(A),"Scritti scelti / Rosa Luxemburg ; a cura di Luciano Amodio. - Milano : Avanti|, 1963. - 716 p., [10] p. di tav. : ill. ; 23 cm",45.4642 N,9.1900 E,Milano,Dedica del curatore Luciano Amodio,,,,
"Anania, Vincenzo",Con la grande stima e l'amicizia di Vincenzo (Anania) Roma - Gennaio  '93,5433,CFI0251581,RISERVATI POESIA.ANANIA 1992(A) ,"*Nell'arco / Vincenzo Anania ; note introduttive di Luca Canali e Dacia Maraini. - Milano : Crocetti, \1992!. - 108 p. ; 20 cm",41.9028 N,12.4964 E,Roma,,Roma,gennaio 1993,https://drive.google.com/file/d/1WnqsfFLvLYteUjwAZNsNv4p35q5UI3fQ/view?usp=sharing,
"Anceschi, Luciano",A Elio Pagliarani il suo L Anceschi,519,SBL0246289,RISERVATI ANTOLOGIE.ANCESCHI 1961(A) ,"*Lirica del Novecento : antologia di poesia italiana / [a cura di] Luciano Anceschi, Sergio Antonielli. - 2. ed. - Firenze : Vallecchi, [1961]. - CVI, 897 p. ; 20 cm",44.4949 N,11.3426 E,Bologna,,,,,
"Annino, Cristina","Al grande poeta Elio Pagliarani i miei auguri più cari, profondi e antichi Cristina Annino 25 maggio 2010.",5264,TO01756160,RISERVATI POESIA.ANNINO 2009(A) ,"*Magnificat : poesie 1969-2009 / Cristina Annino ; a cura di Luca Benassi ; prefazione di Stefano Guglielmin. - Novi Ligure : Puntoacapo, stampa 2009. - 195 p. ; 21 cm",43.7696 N,11.2558 E,Firenze,,,25 maggio 2010,https://drive.google.com/file/d/15lOr6rOsN1mJGhS2CAM87LpxvZOl6Pt8/view?usp=sharing,
"Annino, Cristina","Con profondissima stima, ad Elio, e con affetto vero. Cristina Annino 18-9-2008",3682,BA10044115,RISERVATI.POESIA.ANNINO.2008(A),"*Casa d' Aquila / Cristina Annino. - Bari : Levante, [2008]. - 93 p. ; 17 cm.",43.7696 N,11.2558 E,Firenze,,,18 settembre 2008,https://drive.google.com/file/d/1YYV79GFBOeqtaaFOpEYgSKs65pUOyo7-/view?usp=sharing,
"Apolloni, Ignazio",A Elio Pagliarani Palermo 7.8.1976 Ignazio Apolloni,3699,CFI0161361,RISERVATI NARRATIVA.APOLLONI 1976(A) ,"*Niusia / Ignazio Apolloni. - Palermo : Antigruppo, stampa 1976. - 182 p. : ill. ; 20 cm ((Ed. di 500 esempl.",38.1157° N,13.3615° E,Palermo,,Palermo,7 agosto 1976,https://drive.google.com/file/d/10qooRlY3O9-vrT4u9ty_bCd5vDRG6Jl7/view?usp=sharing,
"Arbasino, Alberto","Per Elio Pagliarani con un caro saluto dal Passato Remoto, Alberto",2398,RAV0262881,RISERVATI NARRATIVA.ARBASINO 1995(A) ,"*Parigi o cara / Alberto Arbasino. - Milano : Adelphi, \1995!. - 311 p. ; 18 cm",,,,,,,https://drive.google.com/file/d/1_q1Gl6DEArmMcZnNoXxmlhtBWjMNTqM3/view?usp=sharing,
"Arbasino, Alberto","Per Elio Pagliarani con un caro saluto dal Passato Remoto, Alberto",2398,RAV0262881,RISERVATI NARRATIVA.ARBASINO 1995(A) ,"Parigi o cara / Alberto Arbasino. - Milano : Adelphi, \1995!. - 311 p. ; 18 cm",,,,,,,https://drive.google.com/file/d/10Xn3RG00l7LproYsaLNR2Fem56R2mPZ9/view?usp=sharing,
"Arbasino, Alberto",Per Elio Pagliarani un cordiale saluto da Alberto Arbasino,1783,RAV0058494,RISERVATI NARRATIVA.ARBASINO 1975(A) ,"La *narcisata / Alberto Arbasino. - Torino : Einaudi, [1975]. - 127 p. ; 20 cm",41.9028° N,12.4964° E,Roma,,,,https://drive.google.com/file/d/1rwaI50OZdidIyqvNb_Jpr_g8rc5qVRHT/view?usp=sharing,
"Arbasino, Alberto",Per Elio con un abbraccio e un applauso anche a Rudi! Alberto,3637,RAV0254013,RISERVATI NARRATIVA.ARBASINO 1995(A) ,"*Specchio delle mie brame / Alberto Arbasino. - Milano : Adelphi, [1995]. - 169 p. ; 22 cm",41.9028° N,12.4964° E,Roma,,,,https://drive.google.com/file/d/13l9mNX0tnnXJxuk8JxYYC8K3O24sNW8b/view?usp=sharing,
"Arbasino, Alberto",Per Elio Pagliarani un caro saluto da Alberto,3642,RAV0053288,RISERVATI NARRATIVA.ARBASINO 1978(A) ,"*Super-Eliogabalo : Romanzo / Alberto Arbasino. - Torino : Einaudi, [1978]. - 351 p. ; 20 cm",41.9028° N,12.4964° E,Roma,,,,https://drive.google.com/file/d/1giMiMJ9YWoa1oY5icQtklY-E6sxTBJCS/view?usp=sharing,
"Arbasino, Alberto",Per Elio Pagliarani con un saluto da Alberto,3644,RAV0304497,RISERVATI NARRATIVA.ARBASINO 1997(A) ,"*Passeggiando tra i draghi addormentati / Alberto Arbasino. - Milano : Adelphi, \1997!. - 271 p. ; 18 cm",41.9028° N,12.4964° E,Roma,,,,https://drive.google.com/file/d/1cdFG8RQ4o5qR76S_W1KfFCgdhMS8QCMU/view?usp=sharing,
"Arbasino, Alberto",Per Elio con mille e mille auguri carissimi da Alberto 21-03-2006,4022,LO11037365,RISERVATI NARRATIVA.ARBASINO 2006 ,"*Dall'Ellade a Bisanzio / Alberto Arbasino. - Milano : Adelphi, [2006]. - 164 p., [8] c. di tav. : ill. ; 18 cm",41.9028° N,12.4964° E,Roma,,,21 marzo 2006,https://drive.google.com/file/d/105cKl9inyiETg3KzJqlJztc7dQXMIaAG/view?usp=sharing,
"Arbasino, Alberto","Per Elio Pagliarani con un caro saluto, Alberto",3687,SBL0148545  ,RISERVATI.NARRATIVA.ARBASINO.1977(A),"*Certi Romanzi / Alberto Arbasino. - Nuova ed. seguita da La belle epoque per le scuole. - Torino : Einaudi, [1977]. - 371 p. ; 20 cm",41.9028° N,12.4964° E,Roma,,,,https://drive.google.com/file/d/1dxtPFMUqM94dsbxav5Q9-e0bwOY4AVA6/view?usp=sharing,
"Arbasino, Alberto","Per Elio Pagliarani con un caro saluto dal Passato Remoto, Alberto",2398,RAV0262881,RISERVATI NARRATIVA.ARBASINO 1995(A),"*Parigi o cara / Alberto Arbasino. - Milano : Adelphi, \1995!. - 311 p. ; 18 cm",,,,,,,,
"Ardini, Carlo","A Elio e Cetta la coppia perfetta, a Cetta e Elio il mio Vangelio con affetto Carlo Viserba 16 febb. 2001",5265,BVE0271505 ,RISERVATI.NARRATIVA.ARDINI.2001(A),"La *pesca reale : Romanzo / Carlo Ardini. - Rimini : La stamperia, stampa 2001. - 231 p. ; 21 cm",42.4207° N,12.1077° E,Viserba,,Viserba,16 febbraio 2001,https://drive.google.com/file/d/1a_B583-8IkDifclkuRs8dkr2G1yxS4TN/view?usp=sharing,
"Ardizzone, Luisa",A Elio Pagliarani Maria Luisa Ardizzone,4711,CFI0057805,RISERVATI NARRATIVA.ARDIZZONE 1984(A) ,"La *vita dispersa / Maria Luisa Ardizzone. - Milano : All'insegna del pesce d'oro, 1984. - 176 p. ; 17 cm ((Ed. di 1500 copie num.",40.7128° N,74.0060° W,New York City,,,,https://drive.google.com/file/d/1TC87FiuJ6RxZtb6fTZeYMNHTiBFso5Jh/view?usp=sharing,
"Arminio, Franco",a Elio Pagliarani,4854,MIL0781925,RISERVATI POESIA.ARMINIO 1997 ,"*Homo timens / Franco Arminio. - Serra di Pratola (AV) : Sellino & Barra, 1997. - 155 p. ; 18 cm",41.0153° N,15.3759° E,Bisaccia,,,,,
"Asor Rosa, Alberto",A Elio Pagliarani con amicizia Alberto Asor Rosa,3663,RAV1208866,RISERVATI SAGGISTICA.ASORROSA 2004(A) ,"*Novecento primo, secondo e terzo / Alberto Asor Rosa. - Nuova ed. aggiornata di Un altro Novecento. - Milano : Sansoni, 2004. - XXII, 570 p. ; 20 cm",41.9028° N,12.4964° E,Roma,,,,https://drive.google.com/file/d/1UDdo-gihg3XvxTXs2h1PKIliKa_XQTt4/view?usp=sharing,
"Attolico, Leopoldo",A Concetta ed Elio cari Leopoldo XI 2009,4006,IEI0666569,RISERVATI POESIA.ATTOLICO 2009(R) ,"*Mi (s)consenta / Leopoldo Attolico ; con sette opere di Ester Ciammetti. - Bollate : Signum edizioni d'arte, 2009. - 24 p. : ill. ; 14 cm",45.4642° N,9.1900° E,Milano,,,novembre 2009,,
"Baino, Mariano",A Elio Pagliarani in amicizia Mariano Baino 2001,4659,MIL0514430,RISERVATI POESIA.BAINO 2000(A) ,"*Pinocchio (moviole) : (1995-98) / Mariano Baino ; introduzione di Francesco Leonetti. - Lecce : Piero Manni, 2000. - 71 p. ; 21 cm",40.8518° N,14.2681° E,NAPOLI,,,2001,,
"Baldini, Raffaello","A Elio con amicizia Lello Milano, febbraio 1982",4652,RLZ0209739,RISERVATI POESIA.BALDINI 1982(A) ,"La *nàiva : *versi in dialetto Romagnolo / Raffaello Baldini ; introduzione di Dante Isella. - Torino : Einaudi, c1982. - XI, 144 p. ; 19 cm ((Traduzione italiana in calce.",45.4642° N,9.1900° E,Milano,,Milano,febbraio 1982,https://drive.google.com/file/d/1sYC_966sZSiDFuvR6Y0ol_99aOWxFOLD/view?usp=sharing,
"Baldini, Raffaello","Devi credermi, Elio sono più sbalordito di te. Un abbraccio Lello Milano, 14 gennaio 1977",5195,SBL0148969,RISERVATI POESIA.BALDINI 1976(A) ,"E' *solitèri : versi in dialetto Romagnolo / Raffaello Baldini. - Imola : Grafiche Galeati, stampa 1976. - 71 p. ; 23 cm",45.4408° N,9.1900° E,9.1900° E,,Milano,14 gennaio 1977,https://drive.google.com/file/d/1wkIz6I43PJhIq7VXfIP8bXCL56LeO6hC/view?usp=sharing,
"Balestrini, Nanni",A Elio Pagliarani con tanta amicizia Nanni Balestrini,787,SBL0524066,RISERVATI POESIA.BALESTRINI 1961(A) ,"Il *sasso appeso / Nanni Balestrini. - Milano : All'insegna del pesce d'oro, 1961. - 39 p. ; 12x12 cm ((Ed. di 500 esempl. num.",45.4642° N,,Milano,,,,https://drive.google.com/file/d/1R_m8tgUZcexIf22qmVadtSEe7jyqgV-e/view?usp=sharing,
"Balestrini, Nanni",Al mio caro Elio Nanni,844,RAV0090695,RISERVATI POESIA.BALESTRINI 1965(A) ,"*Altri procedimenti : 1964-65 / Nanni Balestrini. - Milano : All'insegna del pesce d'oro, [1965]. - 61 p. ; 16x16 cm ((Ed. di 600 esemplari numerati, più 50 esemplari f.c. numerati I-L",45.4408° N,9.1900° E,Milano,,,,https://drive.google.com/file/d/1sG3oPWTNHX2H0LfTv_Ewm4idxfxUgN10/view?usp=sharing,
"Balestrini, Nanni",A Elio caro amico compagno bravissimo con affetto Nanni settembre 2003,3651,VEA0181784,RISERVATI POESIA.BALESTRINI 2003(A) ,"*Tutto in una volta : 50 poesie per 50 anni / Nanni Balestrini. - Spinea : Edizioni del Leone, 2003. - 106 p. ; 20 cm",45.4408° N,9.1900° E,Milano,,,settembre 2003,https://drive.google.com/file/d/1qolOvSocKS6tvh9oe1yxKx5YX7J-gp-N/view?usp=sharing,
"Balestrini, Nanni",Caro Elio con tanto affetto! Nanni marzo 1987,3714,CFI0052771,RISERVATI POESIA.BALESTRINI 1986(A) ,"*Ipocalisse : 49 sonetti : Provenza, 1980-1983 / Nanni Balestrini. - Milano : Libri Scheiwiller, 1986. - 79 p. ; 17 cm",45.4408° N,9.1900° E,Milano,,,marzo 1987,https://drive.google.com/file/d/1UjsjNQt7kngB0xE5QeLjLsZrLL9W9Xn7/view?usp=sharing,
"Balestrini, Nanni",di Elio Pagliarani,4126,LO11163390,RISERVATI NARRATIVA.BALESTRINI 2007/2(A) ,"*Tristano : Romanzo multiplo / Nanni Balestrini ; prefazione di Umberto Eco. - Roma : Derive Approdi, 2007",45.4408° N,9.1900° E,Milano,"Firma dell'A. nell'occhietto e sua nota ""di Elio Pagliarani"" sulla copertina",,,https://drive.google.com/file/d/1DeSCT5JjbXZcvYlrFLy9peAIXIbe4fcE/view?usp=sharing,
"Balestrini, Nanni",A Elio con lunghissima amicizia! Nanni febbraio 2007,5438,UMC0656888,RISERVATI MOSTRE.BALESTRINI 2006(A) ,"*Nanni Balestrini: *con gli occhi del linguaggio. - Milano : Fondazione Mudima ; Roma : DeriveApprodi, stampa 2006. - 177 p. : ill. ; 25 cm ((Catalogo della Mostra tenuta a Milano nel 2006.",45.4408° N,9.1900° E,Milano,,,febbraio 2007,,
"Ballerini, Luigi",A Elio con l'affetto antico del suo Gigi Venezia 13 giugno 1994,3716,MIL0214709,RISERVATI POESIA.BALLERINI 1994(A) ,"Il *terzo gode / Luigi Ballerini ; con un saggio di Remo Bodei. - Venezia : Marsilio, 1994. - 128 p. ; 19 cm",45.4408° N,12.3155° E,Milano,,Venezia,13 giugno 1994,https://drive.google.com/file/d/1zgSq414bRVgtEzJhdSJDXMwI5yjaeOSS/view?usp=sharing,
"Ballerini, Luigi",A Elio con molta simpatia stima e affetto il suo Luigi Roma giugno '72,4655,MIL0103657,RISERVATI POESIA.BALLERINI 1972(A) ,"*eccetera. E / Luigi Ballerini. - Parma : Guanda, 1972. - 56 p. ; 19 cm",41.9028° N,12.4964° E,Roma,,Roma,giugno 1972,,
"Ballerini, Luigi ",Al carissimo Elio ritrovato (in gran forma) con l'affetto (vivissimo) del suo Luigi  Milano (poesia) 1989,2366,UPG0025052 ,RISERVATI.NARRATIVA.BALLERINI.1988(A),"*Che figurato muore / Luigi Ballerini. - Milano : All'insegna del pesce d'oro, 1988",45.4642° N,9.1900° E,Milano,,Milano,1989,,
"Ballerini, Luigi ","Ciao Elio, un abbraccio dal tuo L.",5795,USM1827823 ,RISERVATI.SAGGISTICA.BALLERINI.1989(A),"*Divagazione stilnovista ovvero del ""Ripigliare matera nova"" / Luigi Ballerini. - [S. l. : s. n.], 1989",45.4408° N,9.1900° E,Milano,,,,https://drive.google.com/file/d/1Yky_63h58YwAjSu3gS1fjl62-GvQz_lm/view?usp=sharing,
"Basile, Antonio",A Elio Pagliarani con stima Antonio Basile (segue indirizzo),5925,IEI0698660,RISERVATI.VARIA.AFORISMI.BASILE.1991(A),"*Oltre l'Occidente : (21 aforismi) / Antonio Basile. - Firenze : Carattteri, stampa 1991. - 35 p. ; 21 cm",43.7696° N,11.2558° E,Firenze,,Firenze (guarda la foto) ,,https://drive.google.com/file/d/10AswWM5hE9Yo0EMAEGdLzPeSNdJ1Xi2j/view?usp=sharing,
"Battaglia, Giulia","Al vecchio amico, grande poeta Elio Pagliarani! queste mie poesiole che mi è piaciuto scrivere anzichè dipingere. Giulia B. Buon Natale a te e alla tua famiglia 12 dicembre 2004",5266,IEI0261906,RISERVATI POESIA.BATTAGLIA 2004(A) ,"*Parole come colori / Giulia Battaglia ; con una nota di Elio Pecora sulla poesia dell'autrice e uno. - Roma : Edizioni dell'Elefante, [2004!",45.4184° N,9.2678° E,San Donato,,,12 dicembre 2004,https://drive.google.com/file/d/1ePD-bDYWSNCW1MPaP5D5R8khRwBk8ru0/view?usp=sharing,
"Beltrametti, Franco","Tutto questo: una scelta su 12 anni, a Elio Pagliarani, con stima e amicizia da Franco Beltrametti 11/VI/90",2204,VEA0049527,RISERVATI POESIA.BELTRAMETTI 1990(A) ,"*Tutto questo / Franco Beltrametti. - Venezia : Supernova, \1990!. - 216 p. ; 17 cm",45.9008° N,8.9708° E,Riva San Vitale (Svizzera),,,11 giugno 1990,https://drive.google.com/file/d/1K41qpksj4K8JMxUZP2-sXrdHxRqy6tEy/view?usp=sharing,
"Beltrametti, Franco",9-2-1990 a Elio Pagliarani questo bel libro a quattro con amicizia Franco Beltrametti,4197,UBO1861544,RISERVATI ARTE.BELTRAMETTI 1989(A) ,"A *gang of 4 : Franco Beltrametti, Julien Blaine, James Koller, Tom Raworth. - Brunswick (Maine) : Coyotes Journal, c1989",45.9008° N,8.9708° E,Riva San Vitale (Svizzera),,,9 febbraio 1990,,
"Beltrametti, Franco",9-2-90 A Elio Pagliarani con stima e simpatia da Franco Beltrametti Riva San Vitale,5187,UBO1862181,RISERVATI POESIA.BELTRAMETTI 1990(A) ,"*Niente da / Franco Beltrametti. - Milano : Corpo 10, [1990?]. - 97 p. ; 22 cm",45.9008° N,8.9708° E,Riva San Vitale (Svizzera),,Riva San Vitale (Svizzera),9 febbraio 1990,https://drive.google.com/file/d/1VtSHa8jmsN9Uhmofv44FU_vVYSGXW-GO/view?usp=sharing,
"Bemporad, Giovanna","A Elio nel ricordo degli incontri lontanissimi, quasi irreali, della nostra appassionata adolescenza, grondante di poesia ... con affetto Giovanna Roma 3 dicembre 1980",562,RAV0092519,RISERVATI POESIA.BEMPORAD 1980(A) ,"*Esercizi : poesie e traduzioni / Giovanna Bemporad. - Milano : Garzanti, 1980. - 181 p. ; 22 cm",41.9028° N,12.4964° E,Roma,,Roma,3 dicembre 1980,https://drive.google.com/file/d/1-s2BtuNntHJ2gf1_Lr6axAY_65rBBhlU/view?usp=sharing,
"Bemporad, Giovanna ","A Cetta e Elio sperando che in loro si rinnovi (per mio tramite! ...) il meraviglioso incontro con la poesia di Omero. affettuosamente Giovanna Roma, 27 febbraio 2001",5763,VIA0030992 ,RISERVATI.POESIA.OMERO.1992(A),"*Odissea / Omero ; nella versione poetica di Giovanna Bemporad tutti i canti, per intero o a frammenti ; introduzione di Maurizio Perugi. - Firenze : Le Lettere, 1992",41.9028° N,12.4964° E,Roma,Dedica del trad. Giovanna Bemporad,Roma,27 febbraio 2001,https://drive.google.com/file/d/1oMyaeN7Yc_PYA4I3w63_cNlUrLIczp5K/view?usp=sharing,
"Bernari, Carlo",A Elio Pagliari con  vera amicizia Carlo Bernari Milano Maggio' 64,5715,SBL0274119,RISERVATI.NARRATIVA.BERNARI.1964(A),"*Era l'anno del sole quieto / Carlo Bernari. - Milano : A. Mondadori, 1964. - 276 p. ; 19 cm",45.4642° N,9.1900° E,Milano,,Milano,maggio 1964,https://drive.google.com/file/d/1xnL1O6tCnToDwY_jLWw_wxuGFMnXa_DR/view?usp=sharing,
"Berti Sabbietti, Rosa",A Elio Pagliarani la mia alta stima con la speranza di recensione. Rosa Berti Sabbietti,5127,CFI0214535,RISERVATI POESIA.BERTI/SABBIETTI 1992(A) ,"I *passi del tempo / Rosa Berti Sabbieti ; prefazione di Vittoriano Esposito. - Spinea : Edizioni del Leone, \1992!. - 44 p. ; 20 cm",43.1357° N,13.0683° E,CAMERINO (provincia di MACERATA),,,,,
"Bertolucci, Attilio","A Elio Pagliarani, con la stima, l'amore per la sua poesia di sempre Attilio Bertolucci",533,CFI0050933,RISERVATI POESIA.BERTOLUCCI 1984(A) ,"La *camera da letto / Attilio Bertolucci. - Milano : Garzanti, 1984. - 254 p. ; 21 cm",41.9028° N,12.4964° E,Roma,,,,https://drive.google.com/file/d/14BQaQnigYywVCAQhatNEwLPSjXAhF9We/view?usp=sharing,
"Bertolucci, Attilio","Roma, novembre 1988 A Elio Pagliarani, al poeta sempre vivo e nuovo il suo Attilio Bertolucci",742,RAV0034147,RISERVATI POESIA.BERTOLUCCI 1988(A) ,"La *camera da letto : libro secondo / Attilio Bertolucci. - Milano : Garzanti,  1988. - 138 p. ; 22 cm",41.9028° N,12.4964° E,Roma,,Roma,novembre 1988,https://drive.google.com/file/d/1Lw3K_ocasxlZ4HgGwUqZu50IaJ_Xgc1z/view?usp=sharing,
"Bertolucci, Attilio","A Elio Pagliarani, al poeta all'amico il suo Attilio Bertolucci Roma, 27-2-91",2269,RAV0210584,RISERVATI POESIA.BERTOLUCCI 1991(A) ,"*Al fuoco calmo dei giorni : poesie, 1929-1990 / Attilio Bertolucci ; a cura di Paolo Lagazzi. - Milano : Biblioteca universale Rizzoli, 1991. - 333 p. ; 18 cm",41.9028° N,12.4964° E,Roma,,Roma,27 febbraio 1991,https://drive.google.com/file/d/1-H9n9MYi8IAVoNuiI8kGDKaT3RgdkLcI/view?usp=sharing,
"Bertolucci, Attilio","A Elio Pagliarani dal poeta, all'amico il suo Attilio Bertolucci Roma, maggio 1993",2418,RAV0220108,RISERVATI POESIA.BERTOLUCCI 1993(A) ,"*Verso le sorgenti del Cinghio / Attilio Bertolucci. - Milano : Garzanti, 1993. - 97 p. ; 22 cm",41.9028° N,12.4964° E,Roma,,Roma,maggio 1993,https://drive.google.com/file/d/197F7eScGly4R8gLtWOXipGgoFTN5IyGm/view?usp=sharing,
"Bertolucci, Attilio","Per Elio Pagliarani, per il poeta il suo Attilio Bertolucci Roma, 2 giugno 1994",5057,LO10337966,RISERVATI VARIA.CARTEGGIBERTOLUCCI 1994(A) ,"Una *lunga amicizia : lettere 1938-1982 / Attilio Bertolucci, Vittorio Sereni ; a cura di Gabriella Palli Baroni ; prefazione di Giovanni Raboni. - Milano : Garzanti, 1994. - 327 p. ; 22 cm",41.9028° N,12.4964° E,Roma,,Roma,2 giugno 1994,,
"Bisiach, Gianni","A Elio Pagliarani con amicizia e gratitudine Gianni Bisiach Roma, aprile 1991",3671,CFI0088177,RISERVATI POESIA.MAGRELLI 1987(A) ,"*Nature e venature / Valerio Magrelli. - Milano : A. Mondadori, 1987. - 126 p. ; 22 cm",41.9028° N,12.4964° E,Roma,,Roma,aprile 1991,https://drive.google.com/file/d/1PDZX-Y2aeeDA0jAwR2RzBTHEXkPFSLjC/view?usp=sharing,
"Bisiach, Gianni","A Elio Pagliarani con amicizia e gratitudine Gianni Bisiach Roma, aprile 1991",3703,TO00036313,RISERVATI SAGGISTICA.BISIACH 1991(A) ,"Il *Presidente : la lunga storia di una breve vita / Gianni Bisiach. - 4. ed. - Roma : Newton Compton, 1991. - 446 p., <32> c. di tav. : ill. ; 23 cm",41.9028° N,12.4964° E,Roma,,Roma,aprile 1991,,
"Bisinger, Gerald",Per Elio Pagliarani (v. p.25) con tanti saluti cordiali Gerald Bisinger Berlino nel ottobre 1971,5131,LIG0014063,RISERVATI POESIA.GEIGER 1971(A) ,"*7 Neue Gedichte / Gerald Bisinger. - Torino : Geiger , 1971. - 35 p. ; 15 cm . ((Trad. italiana a fronte",52.5200° N,13.4050° E,Berlino,,Berlino,ottobre 1971,,
"Bodini, Vittorio",All'amico Pagliarani cordialmente Vittorio Bodini Roma ottobre '67.,656,SBL0066060,RISERVATI POESIA.BODINI 1967(A) ,"*Metamor / Vittorio Bodini. - Milano : All'insegna del pesce d'oro, [1967]. - 43 p. ; 16 cm ((Ed. di 600 esempl. num.",41.9028° N,12.4964° E,Roma,,Roma,ottobre 1967,https://drive.google.com/file/d/1DTeHK8AF2P7AMiPaYNGXiG8fids_Hg0s/view?usp=sharing,
"Bonanni, Laudomia",A Elio Pagliarani cordialmente Laudomia Bonanni,3685,RAV0049538,RISERVATI.NARRATIVA.BONANNI.1979(A),"Il *bambino di pietra : una nevrosi femminile / Laudomia Bonanni. - Milano : Bompiani, 1979. - 169 p. ; 21 cm",42.3498° N,13.3995° E,L'Aquila,,,,https://drive.google.com/file/d/134SjwRJ5mQHyL0pJ9Ca0G0MZVTiYyR2F/view?usp=sharing,
"Brignetti, Raffaello","Con stima e amicizia ad Elio Pagliarani, da Raffaello Brignetti Roma, aprile 67",3690, BVE0522448 ,RISERVATI.NARRATIVA.BRIGNETTI.1967(A),"Il *gabbiano azzurro / Raffaello Brignetti. - Torino : Einaudi, 1967. - 196 p. ; 23 cm",41.9028° N,12.4964° E,Roma,,Roma,aprile 1967,https://drive.google.com/file/d/1XW59F8GO5uFnpCrm48PNvkYIb9JSl35a/view?usp=sharing,
"Bruck, Edith",A Elio con affettuosa amicizia Edith Roma 14.3.74.,4782,RAV0077289,RISERVATI NARRATIVA.BRUCK 1974(A) ,"*Due stanze vuote / Edith Bruck ; [presentazione di Primo Levi]. - Padova : Marsilio, 1974. - 114 p. ; 22 cm",41.9028° N,12.4964° E,Roma,,Roma,14 marzo 1974,https://drive.google.com/file/d/1P_yqKQYLjMwKuVoU2QinfWune76f4Ml-/view?usp=sharing,
"Buttitta, Pietro M.",A Elio Pagliarani con fraterno affetto Pietro M. Buttitta,4657,SBL0500077,RISERVATI POESIA.BUTTITTA 1959(A) ,"Una *lettera e altre poesie. - Padova : Rebellato, 1959. - 41 p. ; 17 cm",41.9028° N,12.4964° E,Roma,,,,https://drive.google.com/file/d/1iza--LOg4bmqZ_tQVI_XuK7agfpK3sSG/view?usp=sharing,
"Cacciatore, Edoardo",A Pagliarani molto cordialmente Cacciatore,5044,CFI0054252,RISERVATI POESIA.CACCIATORE 1986(A) ,"*Graduali / Edoardo Cacciatore ; introduzione di Filippo Bettini. - Lecce : P. Manni, 1986. - 115 p. ; 22 cm ((Ed. di 999 esempl.",41.9028° N,12.4964° E,Roma,,,,https://drive.google.com/file/d/1Ky6ZvFb_Ddgi-9fC8DOQX-1OMQACRFDL/view?usp=sharing,
"Caggiati, Marco","A Elio Pagliarani con cordiale ricordo e amicizia Marco Caggiati Milano, l'Avanti agosto '58",806,SBL0485091,RISERVATI POESIA.CAGGIATI 1958(A) ,"La *seconda domenica d'agosto / Marco Caggiati. - Milano : Schwarz ed., stampa 1958. - 70 p. ; 22 cm ((Ed. di 500 esempl. num.",45.4642° N,9.1900° E,Milano,,Milano,agosto 1958,https://drive.google.com/file/d/17fLvXZAZ15mbeIoSoUZMG3PzaWFgcDtL/view?usp=sharing,
"Calabria, Marco",A Elio con grande simpatia e la speranza di fare ancora qualcosa insieme Marco Calabria,866,CFI0243119,RISERVATI SAGGISTICA.CALABRIA 1985(A) ,"*Non ci sono sedie per tutti : una ricerca sulla poesia italiana negli anni settanta / a cura di Mar. - Roma : Valore d'uso, stampa 1985",45.4064° N,11.8768° E,Padua,,,,https://drive.google.com/file/d/1hN2wLGb6MNn9LUj-UKVuRMSJZDmaQU5Z/view?usp=sharing,
"Canducci, Lea  ",A Elio e Maria Concetta con amicizia e stima Lea Canducci Roma 21-9-2001,5425,RMR0021249 ,RISERVATI.POESIA.CANDUCCI.2001(A),"*Terre Nere / Lea Canducci ; incisioni di Marina Bindella, Carlo Lorenzetti, Giulia napoleone, Lucio Passerini. - Roma : Edizioni dell'Oleandro, 2001",41.9028° N,12.4964° E,Roma,,Roma,21 settembre 2001,https://drive.google.com/file/d/15Srk1PdrqdWf2EbOwopoScHV7L41xBPc/view?usp=sharing,
"Caporali, Marco ","A Elio, Cetta e Lia Rosa nel mondo all'aperto l'amicizia e gli auguri di Marco 20/7/91",2360,BVE0041126 ,"RISERVATI,POESIA.CAPORALI.1991(A)","Il *mondo all'aperto / Marco Caporali ; prefazione di Elio Pagliarani. - Roma : Empiria, 1991",42.4088° N,12.6872° E,Cottanello,,,20 luglio 1991,https://drive.google.com/file/d/1yTTFIyydO9UhXfUQmbCz_aWYatsmrjcu/view?usp=sharing,
