"Iarusso, Gabriele",A Elio Pagliarani e Cetta Petrollo per la generosità mostratami e quel conforto/consiglio concessomi Gabriele,5135,BVE0432920,RISERVATI POESIA.IARUSSO 2006(A) ,"*Coito / Gabriele Iarusso. - Roma : Il filo, 2006. - 96 p. ; 20 cm",41.9028° N,12.4964° E,Roma,,,,https://drive.google.com/file/d/1kHRNaLCdWy1qDYEcV6gK3xjP0S8bkIwE/view?usp=sharing,
"Insana, Jolanda","A Elio Pagliarani, conosciuto per la sua passione per i Greci Jolanda Insana Gennaio '88",4035,CFI0238951,RISERVATI POESIA.SAFFO 1985(A) ,"*Poesie / Saffo ; a cura di Jolanda Insana. - Firenze : Estro, [1985]. - 111 p. ; 20 cm ((Testo orig. a fronte.",41.9028° N,12.4964° E,Roma,,,gennaio 1988,https://drive.google.com/file/d/1k7pifoxAr-3YuhWfC6NemKWfsIJuTTnl/view?usp=sharing,
"Insana, Jolanda",A Elio Pagliarani con un caro abbraccio Jolanda,5259,PAR1207671,RISERVATI POESIA.INSANA 2012(A) ,"*Turbativa d'incanto / Jolanda Insana. - Milano : Garzanti, 2012. - 131 p. ; 22 cm",41.9028° N,12.4964° E,Roma,,,,https://drive.google.com/file/d/1cF_SgdRdMACZJsgQsGNMtVEkQ7szeUcv/view?usp=sharing,
"Insana, Jolanda",A Elio Pagliarani mio maestro e molto grata Jolanda Insana,5268,REA0038284,RISERVATI POESIA.INSANA 1997(A) ,"L'*occhio dormiente : 1987-1994 / Jolanda Insana. - Venezia : Marsilio, ©1997. - 110 p. ; 18 cm",41.9028° N,12.4964° E,Roma,,,,https://drive.google.com/file/d/1xCLkQvINCUAMhYMTTVmj9H8DNTV3b1D-/view?usp=sharing,
"Insana, Jolanda",A Elio Pagliarani ah le cene a via Margutta e a via dei Greci Un abbraccio Iolanda,5435,RAV1334776,RISERVATI POESIA.INSANA 2005(A) ,"La *tagliola del disamore / Jolanda Insana. - Milano : Garzanti, 2005. - 140 p. ; 22 cm",41.9028° N,12.4964° E,Roma,,,,https://drive.google.com/file/d/1kZOlZXwdMuJ-7xF18xHTR7tjnWTYiAP_/view?usp=sharing,
"Isgrò, Emilio",A Elio Pagliarani con stima dal suo Emilio Isgrò Milano 1 - aprile -1959,808,CUB0346614,RISERVATI POESIA.ISGRO 1956(A) ,"*Fiere del Sud / Emilio Isgrò. - Milano : Ed. Schwarz, [1956]. - 42 p. ; 22 cm ((Ed. di 500 esempl. num.",45.4642° N,9.1900° E,Milano,,Milano,1 aprile 1959,https://drive.google.com/file/d/1Nfif_PzC4dud-gTi7O1okQ9lq12rZAe7/view?usp=sharing,
"Isgrò, Emilio",A Elio Pagliarani con amicizia e ammirazione sincera per il suo lavoro di poeta Emilio Isgrò,5186,SBL0426598,RISERVATI POESIA.ISGRO 1965(A) ,"*Uomini & donne : poesie / Emilio Isgrò. - Bologna : Sampietro, 1965. - [18] c. : ill. ; 20 x 20 cm",45.4642° N,9.1900° E,Milano,,,,https://drive.google.com/file/d/1zKY_RxBq_1Fbim-Hd4D2RwNeyigJ6qQJ/view?usp=sharing,
"Lagorio, Gina",A Elio Pagliarani Gina Lagorio,2250,BVE0006562,RISERVATI NARRATIVA.LAGORIO 1991(A) ,"*Tra le mura stellate / Gina Lagorio. - Milano : A. Mondadori, 1991. - 293 p. ; 22 cm",45.4642° N,9.1900° E,Milano,,,,https://drive.google.com/file/d/1UwbOxwAP6ZcHKoJ6f8FKmcywEZU3uFm2/view?usp=sharing,
"Leonetti, Francesco","A Elio Pagliarani,  in amicizia Francesco Leonetti '64 ottobre",1696,SBL0265649,RISERVATI NARRATIVA.LEONETTI 1964(A) ,"L'*incompleto / Francesco Leonetti. - Milano : Garzanti, 1964. - 165 p. ; 20 cm",44.4949° N,11.3426° E,Bologna,,,ottobre 1964,https://drive.google.com/file/d/1ELeeoCBPDewRNJGmJ2WjOXE2UZgkn8R6/view?usp=sharing,
"Leonetti, Francesco","A Elio Pagliarani, con un saluto, Francesco Leonetti Ottobre '78",1846,RAV0191845,RISERVATI NARRATIVA.LEONETTI 1978(A) ,"*Conoscenza per errore : studente di Bologna del '48-49 / Francesco Leonetti. - Torino : Einaudi, \1978!. - 160 p. ; 20 cm",45.4642° N,9.1900° E,Milano,,,ottobre 1978,https://drive.google.com/file/d/1F1wZ5GPjcriV2_iEPrNE9jf-1Zs5_Jmf/view?usp=sharing,
"Leonetti, Francesco","A Elio Pagliarani, da Francesco '94",5270,RAV0242284,RISERVATI POESIA.LEONETTI 1994(A) ,"Le *scritte sconfinate / Francesco Leonetti. - Milano : Libri Scheiwiller, 1994. - 117 p. : ill. ; 17 cm ((Ed. di 1000 copie num.",45.4642° N,9.1900° E,Milano,,,1994,https://drive.google.com/file/d/1-b1wYakUXngEtpTRsi4ubdwfIU9SlgNz/view?usp=sharing,
"Leonetti, Francesco","A Elio Pagliarani, in amicizia, in corrispondenza, con una possibilità, mancata, di lavoro comune Francesco Leonetti, 1981",1725,RAV0001603,RISERVATI.NARRATIVA.LEONETTI.1981(A),"*Campo di battaglia / Francesco Leonetti. - Torino : Einaudi, 1981. - 184 p. ; 22 cm",45.4642° N,9.1900° E,Milano,,,1981,https://drive.google.com/file/d/1gCdZJuydCgEOi-uzD_GZyZDgcl2F2IRI/view?usp=sharing,
"Li Vigni Galli, Rina",A Elio Pagliarani con stima grande Rina Li Vigni Galli Catanzaro febbraio '92,5126,MIL0782466,RISERVATI POESIA.LI/VIGNI/GALLI 1991(A) ,"Le *parole mansuete : poesie / Rina Li Vigni Galli ; con una prefazione di Mario Spinella. - Udine : Campanotto,stampa 1991. - 79 p. ; 20 cm",38.9098° N,"16.5877° E",Catanzaro,,Catanzaro,febbraio 1992,https://drive.google.com/file/d/159uuS_UngOaELov8SbnxvGzGnh7XGC4v/view?usp=sharing,
"Lilli, Laura","Dedica dell'A. a Elio Pagliarani: A Elio Pagliarani amico di tanti anni, maestro da sempre Laura Lilli. - Roma, maggio 2001",5129,RMR0019831,RISERVATI POESIA.LILLI 2001(A) ,"*Otto quarti d'ora / Laura Lilli. - Roma : Empirìa, \2001!. - 95, 103 p. ; 21 cm ((Pubbl. bifronte.",41.9028° N,12.4964° E,Roma,,Roma,maggio 2001,https://drive.google.com/file/d/1gpzoJElSKx6OKG_TBsObNfM-1j-Dr61N/view?usp=sharing,
"Lisi, Tommaso",A Elio Pagliarani che ha scelto di essere un corenese di passaggio la stima e la gratitudine di un corenese stanziale che non ha avuto scelta Tommaso Lisi Coreno A. 31 ag. '96,5130,CFI0309449,RISERVATI POESIA.LISI 1995(A) ,"1: *In punta d'ago / Tommaso Lisi ; con lettera di Macrì. - 2 ed. - Grottammare : Stamperia dell'arancio, 1995. - 87 p. : ill. ; 17 cm",41.3440° N,13.7747° E,CORENO AUSONIO,,Coreno Ausonio,31 agosto 1996,https://drive.google.com/file/d/1QTh10IMpBsVchahd45UHXWwZBytApoNc/view?usp=sharing,
"Lo Russo, Rosaria","Aprile 2005 Per il mio maestro amico Elio, Rosaria",5431,LO10888749,RISERVATI POESIA.LORUSSO 2004(A) ,"Lo *dittatore amore : melologhi / Rosaria Lo Russo. - Milano : Effigie, 2004. - 86 p. ; 24 cm + 1 compact disc",43.7696° N,11.2558° E,Firenze,,,aprile 2005,,
"Lombardi, Germano",Al ragazzo Pagliarani con affetto e amicizia da Germano Lombardi,1673,RAV0059335,RISERVATI NARRATIVA.LOMBARDI 1963(A) ,"*Barcelona : Romanzo / Germano Lombardi. - Milano : Feltrinelli, 1963. - 171 p. ; 20 cm",48.8566 N,2.3522 E,Parigi,,,,,
"Longo, Nicolino","All'illustre poeta prof. Elio Pagliarani. con i sensi della mia più alta stima, e la mia preghiera di stilare, se possibile, una recensione. L'autore. 26 marzo 2009 (segue indirizzo)",5042,BA10050293,RISERVATI POESIA.LONGO 2008(A) ,"*Ablativo assoluto : poesie / Nicolino Longo ; prefazione di Vincenzo Guarracino. - Bari : Giuseppe Laterza, stampa 2008. - 116 p. ; 21 cm",39.8449° N,15.7926° E,SAN NICOLA ARCELLA,,,26 marzo 2009,https://drive.google.com/file/d/1850GcGxuMhxtbqbXq68R7rs1uK7S1auN/view?usp=sharing,
"Longo, Nicolino","All'insigne poeta, giornalista, scrittore e saggista prof. Elio Pagliarani (da cui ho tratto il gusto della impostazione tipografica della poesia) con i sensi di tutte le mie stime e riconoscenza e la viva speranza che egli possa concedermi l'alto onore ""letterario"" di una sua pur breve recensione ... la saluto ed abbraccio con infinito affetto e cordialità N.L, 11-6-83.",5821,VEA0981956,RISERVATI POESIA.LONGO.2010(A) ,"*Poesie : una raccolta di poesie mie e d'altri meglio di me / Nicolino Longo ; prefazione            di Nino Scalisi. - Cosenza : Biondi, 1982 - 199 p. : ill. ; 23 cm",39.8449° N,15.7926° E,SAN NICOLA ARCELLA,,,,https://drive.google.com/file/d/16kgSqClPRv9xbzfMBhS1Dai0S5Bded9q/view?usp=sharing,
"Lunetta, Mario",per Cetta e Elio da Mario Lunetta,3707,BA10070822,RISERVATI POESIA.LUNETTA 2011(A) ,"*Identificazione biometrica : poesie scritte in sogno : 2003-2010 / Mario Lunetta ; postfazione di Stefano Lanuzza. - Roma : Robin, 2011. - 125 p. ; 20 cm",41.9028° N,12.4964° E,Roma,,,,,
"Lunetta, Mario",A Elio Pagliarani con l'ammirazione e l'affettuoso saluto di Mario Lunetta,4633,BVE0368797,RISERVATI POESIA. LUNETTA 2004 ,"*Magazzino dei monatti / Mario Lunetta ; prefazione di Francesco Muzzioli. - Pasian di Prato : Campanotto, [2004]. - 201 p. ; 17 cm",41.9028° N,12.4964° E,Roma,,,,https://drive.google.com/file/d/1d2A13OF1RxzVsMOVGBpanE_G-Z5WK5To/view?usp=sharing,
"Lunetta, Mario","A Cetta e Elio, con affetto e serenità condizionata Mario Lunetta.",4660,BVE0441162,RISERVATI POESIA.LUNETTA 2006(A) ,"*Mappamondo & altri luoghi infrequentabili / Mario Lunetta. - Pasian di Prato : Campanotto, [2006]. - 122 p. ; 17 cm",41.9028° N,12.4964° E,Roma,,,,https://drive.google.com/file/d/1oTCPPeopBCo5-iDfpft9f8uuGB1I354k/view?usp=sharing,
"Lunetta, Mario",Per Elio Pagliarani con l'amicizia di Mario Lunetta,5690,MIL0646262,RISERVATI.NARRATIVA.LUNETTA.1998(A),"*Penalty / Mario Lunetta ; prefazione di Giuseppe Neri. - Roma : [s.n.], 1998. - 38 p. ; 21 cm. ((Ed. priv. di 200 esempl. num.",41.9028° N,12.4964° E,Roma,,,,,
"Luzzi, Giorgio",A Elio Pagliarani con ammirazione con cordiale pensiero il tuo giorgio Luzzi,3648,VIA0062804,RISERVATI POESIA.LUZZI 1997(A) ,"*Predario / Giorgio Luzzi. - Venezia : Marsilio, 1997. - 132 p. ; 19 cm",45.0703° N,7.6869° E,Torino,,,,https://drive.google.com/file/d/1Z9F4ro_md1MCGv5lYl4fL6xFzl0udYlD/view?usp=sharing,
"Luzzi, Giorgio","A Elio Pagliarani, con simpatia e cordialità Giorgio Luzzi Sett.90",4957,CFI0198547,RISERVATI POESIA.LUZZI 1990(A) ,"*Mosaico dei rifugi / Giorgio Luzzi. - Milano : Crocetti, 1990. - 100 p. ; 20 cm",45.0703° N,7.6869° E,Torino,,,settembre 1990,https://drive.google.com/file/d/1Fif1BSLfIS0zWj06YOkjth8qgpvBnEXX/view?usp=sharing,
"Maffia, Dante","A Elio, con antica amicizia, Dante",3657,MIL0627443,RISERVATI POESIA.MAFFIA 2003(A) ,"La *biblioteca d'Alessandria / Dante Maffia. - Roma : Lepisma, 2003. - 30 p. ; 17 cm",41.9028° N,12.4964° E,Roma,,,,,
"Magrelli, Valerio","Roma, marzo '99 A Elio, con il ricordo di Valerio",4929,RAV0330626,RISERVATI POESIA.MAGRELLI 1999(A) ,"*Didascalie per la lettura di un giornale / Valerio Magrelli. - Torino : G. Einaudi, [1999]. - 93 p. ; 18 cm",41.9028° N,"12.4964° E
",Roma,,Roma,marzo 1999,,
"Magrelli, Valerio","Roma 10-8-96 A Elio, col ricordo e l'amicizia di Valerio",5432,RAV0273124,RISERVATI POESIA.MAGRELLI 1996(A) ,"*Poesie (1980-1992) e altre poesie / Valerio Magrelli. - Torino : G. Einaudi, [1996]. - 320 p. ; 18 cm ((Contiene: Ora serrata retinae, Nature e venature, Esercizi di tiptologia.",41.9028° N,"12.4964° E
",Roma,,Roma,10 agosto 1996,https://drive.google.com/file/d/1W_I0eF1hlyjYpHmFmxQhZSovUPyw0Cfh/view?usp=sharing,
"Magrelli, Valerio ","Roma, marzo '87 A Elio Pagliarani, e al nostro incontro di dodici anni fa, col ricordo di Valerio Magrelli",3671,CFI0088177  ,RISERVATI.POESIA.MAGRELLI.1987(A),"*Nature e venature / Valerio Magrelli. - Milano : A. Mondadori, 1987",41.9028° N,"12.4964° E
",Roma,,Roma,marzo 1987,,
"Magrelli, Valerio ","Roma, 26-5-95 A Elio, giusto a vent'anni della mia prima uscita, con l'affetto immutato di Valerio",5586,LO10090237 ,RISERVATI.POESIA.MAGRELLI.1992(A),"*Esercizi di tiptologia / Valerio Magrelli. - Milano : A. Mondadori, 1992",41.9028° N,"12.4964° E
",Roma,,Roma,26 maggio 1995,https://drive.google.com/file/d/1kaq_HHCirL13WaUxWm4DdqZP51zdId8B/view?usp=sharing,
"Majellaro, Nino",A Elio Pagliarani Nino Majellaro,5055,UBO2137912,RISERVATI POESIA.MAJELLARO 1974(A) ,"La *memoria artificiale / Nino Majellaro. - Torino : Geiger, stampa 1974. - 60 p. ; 19 cm",45.6397° N,9.0007° E,GERENZANO,,,,https://drive.google.com/file/d/15jpkGwpHMJLCeYxSsWq5hGpx9LgAlr2P/view?usp=sharing,
"Majorino, Giancarlo",Con un saluto Giancarlo,2264,RAV0129921,RISERVATI POESIA.MAJORINO 1990(A) ,"La *solitudine e gli altri / Giancarlo Majorino. - Milano : Garzanti, 1990. - 95 p. ; 22 cm",45.4642° N,9.1900° E,Milano,,,,https://drive.google.com/file/d/1i1ruMnlDZMElk1Pg7TxIcumVbLCoLS06/view?usp=sharing,
"Majorino, Giancarlo","Per Elio, con amicizia Giancarlo 15/5/09",3800,RAV1675858,RISERVATI POESIA.MAJORINO 2008(A) ,"*Viaggio nella presenza del tempo / Giancarlo Majorino. - Milano : Oscar Mondadori, 2008. - 424 p. ; 20 cm",45.4642° N,9.1900° E,Milano,,,15 maggio 2009,https://drive.google.com/file/d/1kRpwduuTiKd_TjrX3y_4lH0BxEhjwE_Q/view?usp=sharing,
"Majorino, Giancarlo",Si girava ... per la città ecc. un saluto Giancarlo 7/6/94,3945,URB0379025,RISERVATI POESIA.MAJORINO 1994(A) ,"La *capitale del nord / Giancarlo Majorino. - 2. ed. - Milano : Edizioni dell'arco, [1994]. - 58 p. ; 21 cm",45.4642° N,9.1900° E,Milano,,,7 giugno 1994,https://drive.google.com/file/d/1EjIx3ctJiHeL3tO2Ffu_cn8mlxkC4swv/view?usp=sharing,
"Majorino, Giancarlo",A Elio è soltanto il primo ... con un saluto Giancarlo 14/3/2004,4954,UBO2393295,RISERVATI POESIA.MAJORINO 2004(A) ,"*Prossimamente / Giancarlo Majorino. - Milano : Mondadori, 2004. - 146 p. ; 18 cm",45.4642° N,9.1900° E,Milano,,,14 marzo 2004,https://drive.google.com/file/d/1DwXTZC44u3AxHGniQ2aPKVbfOjrfj_8H/view?usp=sharing,
"Majorino, Giancarlo",Ciao Elio Giancarlo 5/6/92,5426,CFI0260967,RISERVATI POESIA.MAJORINO 1991(A) ,"*Cangiante / poesie di Giancarlo Majorino ; acquerelli di Carlo Nangeroni. - Milano : All'insegna del pesce d'oro, 1991",45.4642° N,9.1900° E,Milano,,,5 giugno 1992,https://drive.google.com/file/d/1swXoefQquBOZEl67XcwOmNunPdKveCB-/view?usp=sharing,
"Malerba, Luigi",A Elio affettuosamente Gigi Malerba Roma 7 giugno 1973,3692,SBL0595188 ,RISERVATI.NARRATIVA.MALERBA1973(A)," Il *protagonista / Luigi Malerba. - Milano : Bompiani, [1973]. - 193 p. ; 20 cm",41.9028° N,"12.4964° E
",Roma,,Roma,7 giugno 1973,https://drive.google.com/file/d/1IRt26-YoMto21oKeusZyIZjqW05e9l15/view?usp=sharing,
"Malerba, Luigi ",A Elio affettuosamente Gigi Malerba Milano 8 maggio 1968,1688,CFI0985034 ,NARRATIVA.MALERBA.1968(A),"*Salto mortale / Luigi Malerba. - Milano : Bompiani, 1968",45.4642° N,12.4964° E,Milano,,Milano,8 maggio 1968,https://drive.google.com/file/d/1A3NqxQxddwTqSP6q8nF0MAHi4gR82WUt/view?usp=sharing,
"Manacorda, Giorgio",A Elio al gran poeta da Giorgio Roma 6-2-2012,3654,UBO3914797,RISERVATI NARRATIVA.MANACORDA 2012(A) ,"Il *corridoio di legno / Giorgio Manacorda. - Roma : Voland, 2012. - 159 p. ; 21 cm",41.9028° N,12.4964° E,Roma,,Roma,6 febbraio 2012,https://drive.google.com/file/d/1o8UTY9ZUiMc8po9iwjVklkuJPIUAbeRh/view?usp=sharing,
"Manganelli, Giorgio",A Elio con l'amicizia di Giorgio novembre '81.,1667,TO00035962,RISERVATI NARRATIVA.MANGANELLI 1981(A) ,"*Angosce di stile / Giorgio Manganelli. - Milano : Rizzoli, 1981. - 189 p. ; 23 cm ((Raccolta di prefaz. a opere di diversi autori.",41.9028° N,12.4964° E,Roma,,,novembre 1981,https://drive.google.com/file/d/1vPSDfMG5LFzvGx7l7l_Kijig9XDMqWnY/view?usp=sharing,
"Manganelli, Giorgio",A Elio con l'amicizia di sempre da Giorgio,1724,RAV0082678,RISERVATI NARRATIVA.MANGANELLI 1981(A) ,"*Amore / Giorgio Manganelli. - Milano : Rizzoli, 1981. - 118 p. ; 23 cm",41.9028° N,12.4964° E,Roma,,,,https://drive.google.com/file/d/1aQOg4Bszgkrrmkp76HhlkSKwn9iNR3cD/view?usp=sharing,
"Manganelli, Giorgio",Al caro Elio un amico saluto da Giorgio,1733,IEI0025499,RISERVATI NARRATIVA.MANGANELLI 1977(A) ,"*Pinocchio : un libro parallelo / Giorgio Manganelli. - Torino : Einaudi, 1977. - VI, 172 p. ; 22 cm",41.9028° N,12.4964° E,Roma,,,,https://drive.google.com/file/d/1byznTwctahTdMKxgZjC5rBW8twhvTASm/view?usp=sharing,
"Manganelli, Giorgio","A Elio, ed ad Elia [i.e.: Cetta Petrollo] ciao da Giorgio agosto 77",1794,TO00036045 ,RISERVATI TEATRO.MANGANELLI 1977(A) ,"*Cassio governa a Cipro / Giorgio Manganelli. - Milano : Rizzoli, 1977. - 97 p. ; 22 cm",41.9028° N,12.4964° E,Roma,,,agosto 1977,https://drive.google.com/file/d/1dotcr4QDh4cm0Ri9vL5zgnjrsFJ47aYF/view?usp=sharing,
"MANGANELLI, Giorgio",A Elio un saluto affettuoso da Giorgio marzo '79,1823,SBL0240470,RISERVATI NARRATIVA.MANGANELLI 1979(A) ,"*Centuria : cento piccoli Romanzi fiume / Giorgio Manganelli. - Milano : Rizzoli, 1979. - 206 p. ; 22 cm",41.9028° N,12.4964° E,Roma,,,marzo 1979,https://drive.google.com/file/d/1h-KZtIGaX__FniEbzdjkJgdIIBwe3czv/view?usp=sharing,
"Manganelli, Giorgio",All'amico Paglia con amicizia dall'amico Manga,1825,TO00036031,RISERVATI NARRATIVA.MANGANELLI 1976(A) ,"*Sconclusione / Giorgio Manganelli. - Milano : Rizzoli, 1976. - 142 p. ; 23 cm",41.9028° N,12.4964° E,Roma,,,,https://drive.google.com/file/d/1--ARKQLqfbVtolb-j8W6iCfSbIm0yuNw/view?usp=sharing,
"Manganelli, Giorgio",Ciao Elio risplendi [!] sul tuo Manganelli,3674,CFI0015152,RISERVATI SAGGISTICA.MANGANELLI 1986(A) ,"*Laboriose inezie / Giorgio Manganelli. - Milano : Garzanti, 1986. - 314 p. ; 21 cm ((Già pubbl. in periodici vari.",41.9028° N,12.4964° E,Roma,,,,,
"Manganelli, Giorgio",A Elio Pagliarani con l'ammirata amicizia di sempre Giorgio Manga,3720,RAV0082678,RISERVATI NARRATIVA.MANGANELLI 1981bis(A) ,"*Amore / Giorgio Manganelli. - Milano : Rizzoli, 1981. - 118 p. ; 23 cm",41.9028° N,12.4964° E,Roma,,,,,
"Manganelli, Giorgio",via Elio fare non è negazione Giorgio,3721,CFI0112018,RISERVATI NARRATIVA.MANGANELLI 1987(A) ,"*Rumori o voci / Giorgio Manganelli. - Milano : Rizzoli, 1987. - 144 p. ; 23 cm",41.9028° N,12.4964° E,Roma,,,,https://drive.google.com/file/d/1gA0O7Udzg3FJ1Tf65Zry7_bhl8YjhyX1/view?usp=sharing,
"Manganelli, Giorgio",Al caro Elio un saluto affettuoso del Giorgio,3722,RAV0080453,RISERVATI NARRATIVA.MANGANELLI 1982(A) ,"*Discorso dell'ombra e dello stemma, o, del lettore e dello scrittore considerati come dementi / Giorgio Manganelli. - Milano : Rizzoli, 1982. - 167 p. ; 22 cm",41.9028° N,12.4964° E,Roma,,,,https://drive.google.com/file/d/1Sr9Bls1Kz4luq54z1MSYbLHBUx0xyypS/view?usp=sharing,
"Manganelli, Giorgio",A Elio con canti scoperti,3723,CFI0015460,RISERVATI NARRATIVA.MANGANELLI 1986(A) ,"*Tutti gli errori / Giorgio Manganelli. - Milano : Rizzoli, 1986. - 134 p. ; 22 cm",41.9028° N,12.4964° E,Roma,,,,https://drive.google.com/file/d/1IH_HQw8v4WWhER4Un5Br4S9J5Upo4b81/view?usp=sharing,
"Manganelli, Giorgio",A Elio con ammirazione e amicizia Giorgio,3724,RAV0088264,RISERVATI NARRATIVA.MANGANELLI 1975(A) ,"*A e B / Giorgio Manganelli. - Milano : Rizzoli, 1975. - 185 p. ; 23 cm",41.9028° N,12.4964° E,Roma,,,,https://drive.google.com/file/d/1jexQNbHsZbRXvnAeg9dBOUaV-yVIt_-Z/view?usp=sharing,
"Manganelli, Giorgio",dal Manga al Paglia ...,3725,CFI0205805,RISERVATI NARRATIVA.MANGANELLI 1989(A) ,"*Antologia privata / Giorgio Manganelli. - Milano : Rizzoli, 1989. - 237 p. ; 23 cm ((Scritti già pubbl.",41.9028° N,12.4964° E,Roma,,,,https://drive.google.com/file/d/1sMajx7V9emnXWLXpbzjJvcTyCoz6O3iu/view?usp=sharing,
"Manganelli, Giorgio",All'amico Paglia con amicizia dall'amico Manga,1825,TO00036031,RISERVATI.NARRATIVA.MANGANELLI.1976(A),"*Sconclusione / Giorgio Manganelli. - Milano : Rizzoli, 1976. - 142 p. ; 23 cm",41.9028° N,12.4964° E,Roma,,,,,
"Manitta, Giuseppe",Al prof. Pagliarani con sincera stima e ammirazione Giuseppe Manitta,4318,PAL0247078,RISERVATI POESIA.MANITTA 2011(A) ,"L'*ultimo canto dell'upupa : poemetto crepuscolare / Giuseppe Manitta ; premessa di Giorgio Barberi. - Castiglione di Sicilia : Il Convivio, 2011",41.9598° N,12.8022° E,Tivoli,,,,,
"Manitta, Giuseppe",Al dott. Pagliarani con sincera stima Giuseppe Manitta,5060,TO01275831,RISERVATI POESIA.MANITTA 2003(A) ,"*Sentieri d'assoluto : poema-racconto / Giuseppe Manitta. - Castiglione di Sicilia : Accademia Internazionale Il Convivio, 2003. - 79 p. ; 21 cm",41.9598° N,12.8022° E,Tivoli,,,,https://drive.google.com/file/d/12wR6iWiHIY_RnCtcaCHgJp97QYwxmrnY/view?usp=sharing,
"Manzi, Gianluca",Per Elio Pagliarani Gianluca Manzi (segue altra firma manoscritta: Pietro Fortuna),5185,URB0445713,RISERVATI POESIA.MANZI 1986(A) ,"La *maison adoptive / Gianluca Manzi ; présentée par Jean-Charles Vegliante ; dessins de Pietro Fort. - Paris : Galerie Montenay-Delsol ; Milano : Studio Guenzani, stampa 1986",41.9028° N,12.4964° E,Roma,,,,https://drive.google.com/file/d/1jIgtPDEnS8O3aDq6wd5H0IWOonz2iaW5/view?usp=sharing,
"Maraini, Dacia",Un caro saluto da Dacia Maraini,4748,IEI0622580,RISERVATI.NARRATIVA.MARAINI.2001(A),"*Buio / Dacia Maraini. - Milano : Rizzoli, 2001. - 219 p. ; 18 cm",41.9028° N,12.4964° E,Roma,,,,https://drive.google.com/file/d/1uC46RwuSth0jmpdBcdpJs4XPwXn4MZzc/view?usp=sharing,
"Marcoaldi, Franco",A Elio Pagliarani Franco Marcoaldi,4658,VIA0064113,RISERVATI POESIA.MARCOALDI 1997(A) ,"*Amore non amore / Franco Marcoaldi. - Milano : Bompiani, 1997. - 72 p. ; 17 cm",42.4375° N,11.1941° E,Laguna di Orbettello,,,,https://drive.google.com/file/d/1FKeKueCwkRyoM4S0IotywvxXk3Bdi-n0/view?usp=sharing,
"Marniti, Biagia","A Elio Pagliarani e Cetta Petrollo, il ricordo e l'augurio di Biagia Marniti",5052,CFI0039136,RISERVATI POESIA.MARNITI 1984(A) ,"La *ballata del mare e altre poesie / di Biagia Marniti. - Riccia : Premio Michele Cima, 1983 (Roma : Lito service, 1984)",41.9028° N,12.4964° E,Roma,,,,https://drive.google.com/file/d/1oai2kybsu5nf8beGTr1oaYZUzXJJbdTj/view?usp=sharing,
"Marniti, Biagia","A Cetta e Elio Pagliarani, grata del ricordo, la mia cordiale attenzione Biagia Marniti Roma, 10.6.'88",5056,USM1789462,RISERVATI POESIA.MARNITI 1988(A) ,"Un *suono cosmico / Biagia Marniti . - Pisa : C. Cursi & F., stampa 1988. - 1 pieghevole : ill. ; 15 cm ((Ed. di 500 esempl. + Disegni di Orso Bugiani",41.9028° N,12.4964° E,Roma,,Roma,10 giugno 1988,https://drive.google.com/file/d/1VAke5jI4vSbONb2yRtVQkJYJ16AeBuCO/view?usp=sharing,
"Marotta, Francesco","Al Prof. Elio Pagliarani
la cui opera rappresenta un insostituibile momento di riflessione e un costante termine di paragone per chiunque voglia impostare un rapporto duraturo con la scrittura poetica.
Con affetto e profonda stima Francesco Marotta",4751,LO10083597,RISERVATI POESIA.MAROTTA 1991 ,"Il *verbo dei silenzi / Francesco Marotta. - [Spinea] : Edizioni del Leone, c 1991. - 69 p. ; 20 cm",45.4642 N,9.1900 E,Milano,,,,https://drive.google.com/file/d/1fDKoBAeyxItf7eG5Yd-tblnn3iCU3ONB/view?usp=sharing,
"Mascioni, Grytzko","A Elio Pagliarani, un suo fedele e antico lettore, con il saluto più cordiale Grytzko Mascioni 1990",3668,BVE0005363,RISERVATI NARRATIVA.MASCIONI 1990(A) ,"La *notte di Apollo / Grytzko Mascioni. - Milano : Rusconi, 1990. - 302 p., [16] c. di tav. : ill. ; 22 cm",46.2004° N,10.1308° E,Villa di Tirano ,,,1990,https://drive.google.com/file/d/1Q_cEWMG1QXUoKkqemMG6sGDC6lMO_Db-/view?usp=sharing,
"Masino, Paola","A Cetta e a Elio Pagliarani con affettuosa amicizia la vecchia, fuori uso Paola Roma 16-11-82",1838,SBL0612845,RISERVATI NARRATIVA.MASINO 1982(A) ,"*Nascita e morte della massaia : Romanzo / Paola Masino. - Milano : La tartaruga, 1982. - 282 p. ; 20 cm .",41.9028° N,12.4964° E,Roma,,Roma,16 novembre 1982,https://drive.google.com/file/d/1V2bJwqlT7JH1xfFFuYZrDlMwIBrE6hOz/view?usp=sharing,
"Masino, Paola","A Cetta e a Elio Pagliarani con affettuosa amicizia la vecchia, fuori uso Paola Roma 16-11-82",1838,SBL0612845 ,RISERVATI.NARRATIVA.MASINO.1982(A),"*Nascita e morte della massaia : Romanzo / Paola Masino. - Milano : La tartaruga, 1982. - 282 p. ; 20 cm",41.9028° N,12.4964° E,Roma,,Roma,16 novembre 1982,,
"Massari, Nino",Ciao Elio 1) perchè sei stato il primo a pubblicare 2) perchè poeta 3) perchè mio amico. Nino,772,UBO1326978,RISERVATI POESIA.MASSARI 1971(A) ,"*Carmina priapea / la traduzione e l'introduzione ai Carmina sono di Nino Massari ; mentre la nota c. - [Roma] : Arcana, stampa 1971",41.9028° N,12.4964° E,Roma,,,,https://drive.google.com/file/d/1IFq8NPwoZl1j3X8rdHgkamHIo-bCWNW5/view?usp=sharing,
"Mauri, Paolo",A Cetta e Elio Pagliarani con affetto Paolo,3700,MOD1389808,RISERVATI SAGGISTICA.MAURI 2007(A) ,"*Buio / Paolo Mauri. - Torino : Einaudi, [2007]. - 118 p. ; 18 cm",41.9028° N,12.4964° E,Roma,,,,,
"Menechella, Grazia","Madison 25 dicembre 2003 Ad Elio e Cetta, con amicizia e nostalgia Graziella",5094,RAV0821407,RISERVATI SAGGISTICA.MENECHELLA 2002(A) ,"Il *felice vanverare : ironia e parodia nell'opera narrativa di Giorgio Manganelli / Grazia Menechella. - Ravenna : Longo, \2002!. - 258 p. : ill. ; 24 cm",43.0766° N,89.4125° W,"Madison, Wisconsin",,Madison,25 dicembre 2003,,
"Meyer, Camargo",A Elio Pagliarani  ofereço cordialmente Camargo Meyer 68,860,UBO1490274,RISERVATI POESIA.MEYER 1964(A) ,"*Cartilha : (1959-1963) / Camargo Meyer. - [Sâo Paulo?] : Massao Ohono, 1964. - 72 p. ; 22 cm",15.7975° S,47.8919° W,"Brasilia, Brasile",,,1968,,
"Miccini, Eugenio","10-3-59 All'""Avanti!"" con simpatia Eugenio Miccini Firenze Via della Scala 53",5137,SBL0501525,RISERVATI POESIA.MICCINI 1959(A) ,"*Senza più verità / Eugenio Miccini. - Bologna : L. Leonardi, stampa 1959. - 55 p. ; 22 cm",43.7696° N,11.2558° E,Firenze,,Firenze,10 marzo 1959,https://drive.google.com/file/d/1kCiCv9eDhR2IItgMQML8tna1O7Tct-Jv/view?usp=sharing,
"Milanoi, Milena",A Elio Pagliarani con viva cordialità milena Milanoi Milano 8 febbraio 1976,3717,SBL0578501,RISERVATI NARRATIVA.MilanoI 1976(A) ,"*Soltanto amore : Romanzo / Milena Milanoi. - Milano : Rusconi, 1976. - 212 p. ; 21 cm",45.4642° N,9.1900° E,Milano,,Milano,8 febbraio 1976,https://drive.google.com/file/d/1YfC0FdUGM2LH6Fbf4mQf_IhI0PJV1Bh3/view?usp=sharing,
"Mincu, Marin",Al poeta Elio Pagliarani con stima e amicizia Marin Mincu,4958,CFI0016220,RISERVATI POESIA.MINCU 1986(A) ,"*In agguato / Marin Mincu ; a cura e con una glossa di Alfredo Giuliani ; con una nota di Mario Luzi. - Milano : All'insegna del pesce d'oro, 1986",43.7696° N,11.2558° E,Firenze,,,,https://drive.google.com/file/d/1bgSuxxsTHoGTDVK4sWUY3wnHHVQ6q0v8/view?usp=sharing,
"Minore, Renato",A Elio caramente Renato,2365,BVE0007686,RISERVATI SAGGISTICA.MINORE 1991(A) ,"*Rimbaud / Renato Minore. - Milano : A. Mondadori, 1991. - 207 p., \4! c. di tav. : ill. ; 23 cm",41.9028° N,12.4964° E,Roma,,,,,
